timestamp,texto_original,texto_traducido,idioma,emocion_predicha,emocion_correcta,confianza,es_correcto
2025-10-27 12:00:00,Estoy muy satisfecho con la atención y la consumo energético ofrecida por la empresa.,I am very satisfied with the consumo energético of the teléfono.,es,love,love,0.986771,True
2025-10-27 12:00:00,Admiro la calidad del crema facial y su impecable velocidad.,I admire the velocidad of the crema facial.,es,love,love,0.982921,True
2025-10-27 12:00:00,Me encanta la acabado de este taller mecánico; ha superado mis expectativas.,I love the acabado of the taller mecánico.,es,love,love,0.917172,True
2025-10-27 12:00:00,Me encanta la material de este envío; ha superado mis expectativas.,I love the material of the envío.,es,love,love,0.969743,True
2025-10-27 12:00:00,Me siento realmente complacido con la actualizaciones; la uso a diario.,I am truly pleased with the actualizaciones of the bicicleta.,es,love,love,0.950355,True
2025-10-27 12:00:00,Me encanta la actualizaciones de este calefactor; ha superado mis expectativas.,I love the actualizaciones of the calefactor.,es,love,love,0.907409,True
2025-10-27 12:00:00,Admiro la calidad del servicio de streaming y su impecable material.,I admire the material of the servicio de streaming.,es,love,love,0.908803,True
2025-10-27 12:00:00,Valoro mucho la consumo energético y la fiabilidad del tablet.,I highly value the consumo energético of the tablet.,es,love,love,0.989745,True
2025-10-27 12:00:00,Me siento realmente complacido con la material; la uso a diario.,I am truly pleased with the material of the calefactor.,es,love,love,0.929896,True
2025-10-27 12:00:00,Este servicio me ha ganado por su excelente resolución de pantalla.,Este servicio me ha ganado por su excelente resolución de pantalla..,es,love,love,0.988199,True
2025-10-27 12:00:00,Este servicio me ha ganado por su excelente seguridad.,Este servicio me ha ganado por su excelente seguridad..,es,love,love,0.902113,True
2025-10-27 12:00:00,Valoro mucho la conectividad y la fiabilidad del teléfono.,I highly value the conectividad of the teléfono.,es,love,love,0.914973,True
2025-10-27 12:00:00,Me encanta la interfaz de este impresora; ha superado mis expectativas.,I love the interfaz of the impresora.,es,love,love,0.985467,True
2025-10-27 12:00:00,Admiro la calidad del firma de lavandería y su impecable servicio postventa.,I admire the servicio postventa of the firma de lavandería.,es,love,love,0.982274,True
2025-10-27 12:00:00,Este servicio me ha ganado por su excelente estabilidad.,Este servicio me ha ganado por su excelente estabilidad..,es,love,love,0.901447,True
2025-10-27 12:00:00,Me siento realmente complacido con la atención al cliente; la uso a diario.,I am truly pleased with the atención al cliente of the bicicleta.,es,love,love,0.960787,True
2025-10-27 12:00:00,Este servicio me ha ganado por su excelente interfaz.,Este servicio me ha ganado por su excelente interfaz..,es,love,love,0.964178,True
2025-10-27 12:00:00,Este servicio me ha ganado por su excelente actualizaciones.,Este servicio me ha ganado por su excelente actualizaciones..,es,love,love,0.977004,True
2025-10-27 12:00:00,Recomendaría el agencia de viajes por su notable garantía sin dudarlo.,Recomendaría the agencia de viajes por su notable garantía sin dudarlo..,es,love,love,0.956213,True
2025-10-27 12:00:00,Estoy muy satisfecho con la atención y la rendimiento ofrecida por la empresa.,I am very satisfied with the rendimiento of the impresora.,es,love,love,0.91555,True
2025-10-27 12:00:00,Este servicio me ha ganado por su excelente privacidad.,Este servicio me ha ganado por su excelente privacidad..,es,love,love,0.966062,True
2025-10-27 12:00:00,Me siento realmente complacido con la privacidad; la uso a diario.,I am truly pleased with the privacidad of the silla ergonómica.,es,love,love,0.908859,True
2025-10-27 12:00:00,Me encanta la atención al cliente de este licuadora; ha superado mis expectativas.,I love the atención al cliente of the licuadora.,es,love,love,0.923626,True
2025-10-27 12:00:00,Este servicio me ha ganado por su excelente calidad de sonido.,Este servicio me ha ganado por su excelente calidad de sonido..,es,love,love,0.936977,True
2025-10-27 12:00:00,Este servicio me ha ganado por su excelente resolución de pantalla.,Este servicio me ha ganado por su excelente resolución de pantalla..,es,love,love,0.967382,True
2025-10-27 12:00:00,Me siento realmente complacido con la garantía; la uso a diario.,I am truly pleased with the garantía of the plancha.,es,love,love,0.960452,True
2025-10-27 12:00:00,Este servicio me ha ganado por su excelente facilidad de uso.,Este servicio me ha ganado por su excelente facilidad de uso..,es,love,love,0.984786,True
2025-10-27 12:00:00,Valoro mucho la actualizaciones y la fiabilidad del envío.,I highly value the actualizaciones of the envío.,es,love,love,0.946563,True
2025-10-27 12:00:00,Me siento realmente complacido con la facilidad de uso; la uso a diario.,I am truly pleased with the facilidad de uso of the cafetera.,es,love,love,0.94748,True
2025-10-27 12:00:00,Estoy muy satisfecho con la atención y la capacidad de carga ofrecida por la empresa.,I am very satisfied with the capacidad de carga of the soporte técnico.,es,love,love,0.920138,True
2025-10-27 12:00:00,Este servicio me ha ganado por su excelente duración de batería.,Este servicio me ha ganado por su excelente duración de batería..,es,love,love,0.985125,True
2025-10-27 12:00:00,Me encanta la relación calidad-precio de este zapatos; ha superado mis expectativas.,I love the relación calidad-precio of the zapatos.,es,love,love,0.908617,True
2025-10-27 12:00:00,Valoro mucho la durabilidad y la fiabilidad del firma de lavandería.,I highly value the durabilidad of the firma de lavandería.,es,love,love,0.984424,True
2025-10-27 12:00:00,Estoy muy satisfecho con la atención y la duración de batería ofrecida por la empresa.,I am very satisfied with the duración de batería of the soporte técnico.,es,love,love,0.929163,True
2025-10-27 12:00:00,Me encanta la relación calidad-precio de este colchón; ha superado mis expectativas.,I love the relación calidad-precio of the colchón.,es,love,love,0.908321,True
2025-10-27 12:00:00,Recomendaría el televisor por su notable comodidad sin dudarlo.,Recomendaría the televisor por su notable comodidad sin dudarlo..,es,love,love,0.933432,True
2025-10-27 12:00:00,Me encanta la estabilidad de este microondas; ha superado mis expectativas.,I love the estabilidad of the microondas.,es,love,love,0.950143,True
2025-10-27 12:00:00,Me encanta la durabilidad de este altavoz; ha superado mis expectativas.,I love the durabilidad of the altavoz.,es,love,love,0.911209,True
2025-10-27 12:00:00,Estoy muy satisfecho con la atención y la material ofrecida por la empresa.,I am very satisfied with the material of the altavoz.,es,love,love,0.975304,True
2025-10-27 12:00:00,Este servicio me ha ganado por su excelente estabilidad.,Este servicio me ha ganado por su excelente estabilidad..,es,love,love,0.956488,True
2025-10-27 12:00:00,Estoy muy satisfecho con la atención y la rendimiento ofrecida por la empresa.,I am very satisfied with the rendimiento of the crema facial.,es,love,love,0.94604,True
2025-10-27 12:00:00,Valoro mucho la seguridad y la fiabilidad del bicicleta.,I highly value the seguridad of the bicicleta.,es,love,love,0.933795,True
2025-10-27 12:00:00,Este servicio me ha ganado por su excelente entrega.,Este servicio me ha ganado por su excelente entrega..,es,love,love,0.949007,True
2025-10-27 12:00:00,Recomendaría el colchón por su notable diseño sin dudarlo.,Recomendaría the colchón por su notable diseño sin dudarlo..,es,love,love,0.989019,True
2025-10-27 12:00:00,Me encanta la funcionalidades de este cámara; ha superado mis expectativas.,I love the funcionalidades of the cámara.,es,love,love,0.916973,True
2025-10-27 12:00:00,Recomendaría el restaurante por su notable entrega sin dudarlo.,Recomendaría the restaurante por su notable entrega sin dudarlo..,es,love,love,0.922149,True
2025-10-27 12:00:00,Recomendaría el microondas por su notable conectividad sin dudarlo.,Recomendaría the microondas por su notable conectividad sin dudarlo..,es,love,love,0.908705,True
2025-10-27 12:00:00,Admiro la calidad del servicio de streaming y su impecable acabado.,I admire the acabado of the servicio de streaming.,es,love,love,0.941284,True
2025-10-27 12:00:00,Valoro mucho la precisión y la fiabilidad del bicicleta.,I highly value the precisión of the bicicleta.,es,love,love,0.98823,True
2025-10-27 12:00:00,Estoy muy satisfecho con la atención y la precisión ofrecida por la empresa.,I am very satisfied with the precisión of the bicicleta.,es,love,love,0.936873,True
2025-10-27 12:00:00,Me encanta la durabilidad de este monitor; ha superado mis expectativas.,I love the durabilidad of the monitor.,es,love,love,0.940081,True
2025-10-27 12:00:00,Me encanta la garantía de este lavadora; ha superado mis expectativas.,I love the garantía of the lavadora.,es,love,love,0.91428,True
2025-10-27 12:00:00,Valoro mucho la compatibilidad y la fiabilidad del bicicleta.,I highly value the compatibilidad of the bicicleta.,es,love,love,0.929853,True
2025-10-27 12:00:00,Admiro la calidad del taxi y su impecable relación calidad-precio.,I admire the relación calidad-precio of the taxi.,es,love,love,0.925852,True
2025-10-27 12:00:00,Admiro la calidad del envío y su impecable seguridad.,I admire the seguridad of the envío.,es,love,love,0.971605,True
2025-10-27 12:00:00,Estoy muy satisfecho con la atención y la funcionalidades ofrecida por la empresa.,I am very satisfied with the funcionalidades of the colchón.,es,love,love,0.98577,True
2025-10-27 12:00:00,Me siento realmente complacido con la velocidad; la uso a diario.,I am truly pleased with the velocidad of the zapatos.,es,love,love,0.905109,True
2025-10-27 12:00:00,Me encanta la comodidad de este detergente; ha superado mis expectativas.,I love the comodidad of the detergente.,es,love,love,0.943963,True
2025-10-27 12:00:00,Recomendaría el plancha por su notable compatibilidad sin dudarlo.,Recomendaría the plancha por su notable compatibilidad sin dudarlo..,es,love,love,0.925753,True
2025-10-27 12:00:00,Estoy muy satisfecho con la atención y la puntualidad ofrecida por la empresa.,I am very satisfied with the puntualidad of the taller mecánico.,es,love,love,0.983596,True
2025-10-27 12:00:00,Valoro mucho la compatibilidad y la fiabilidad del almohada.,I highly value the compatibilidad of the almohada.,es,love,love,0.903434,True
2025-10-27 12:00:00,Recomendaría el bicicleta por su notable facilidad de uso sin dudarlo.,Recomendaría the bicicleta por su notable facilidad de uso sin dudarlo..,es,love,love,0.98699,True
2025-10-27 12:00:00,Estoy muy satisfecho con la atención y la atención al cliente ofrecida por la empresa.,I am very satisfied with the atención al cliente of the impresora.,es,love,love,0.98817,True
2025-10-27 12:00:00,Estoy muy satisfecho con la atención y la velocidad ofrecida por la empresa.,I am very satisfied with the velocidad of the envío.,es,love,love,0.931565,True
2025-10-27 12:00:00,Me encanta la servicio postventa de este aspiradora; ha superado mis expectativas.,I love the servicio postventa of the aspiradora.,es,love,love,0.977843,True
2025-10-27 12:00:00,Valoro mucho la relación calidad-precio y la fiabilidad del plataforma de cursos.,I highly value the relación calidad-precio of the plataforma de cursos.,es,love,love,0.948023,True
2025-10-27 12:00:00,Admiro la calidad del servicio de streaming y su impecable calidad de sonido.,I admire the calidad de sonido of the servicio de streaming.,es,love,love,0.978447,True
2025-10-27 12:00:00,Este servicio me ha ganado por su excelente diseño.,Este servicio me ha ganado por su excelente diseño..,es,love,love,0.941532,True
2025-10-27 12:00:00,Valoro mucho la sensibilidad y la fiabilidad del hotel.,I highly value the sensibilidad of the hotel.,es,love,love,0.975335,True
2025-10-27 12:00:00,Me encanta la puntualidad de este firma de lavandería; ha superado mis expectativas.,I love the puntualidad of the firma de lavandería.,es,love,love,0.962497,True
2025-10-27 12:00:00,Valoro mucho la compatibilidad y la fiabilidad del ventilador.,I highly value the compatibilidad of the ventilador.,es,love,love,0.926665,True
2025-10-27 12:00:00,Este servicio me ha ganado por su excelente puntualidad.,Este servicio me ha ganado por su excelente puntualidad..,es,love,love,0.92707,True
2025-10-27 12:00:00,Admiro la calidad del servicio de streaming y su impecable experiencia de usuario.,I admire the experiencia de usuario of the servicio de streaming.,es,love,love,0.985697,True
2025-10-27 12:00:00,Recomendaría el reloj inteligente por su notable sensibilidad sin dudarlo.,Recomendaría the reloj inteligente por su notable sensibilidad sin dudarlo..,es,love,love,0.958285,True
2025-10-27 12:00:00,Me encanta la acabado de este reloj inteligente; ha superado mis expectativas.,I love the acabado of the reloj inteligente.,es,love,love,0.909504,True
2025-10-27 12:00:00,Me encanta la sensibilidad de este ventilador; ha superado mis expectativas.,I love the sensibilidad of the ventilador.,es,love,love,0.92637,True
2025-10-27 12:00:00,Estoy muy satisfecho con la atención y la duración de batería ofrecida por la empresa.,I am very satisfied with the duración de batería of the crema facial.,es,love,love,0.968496,True
2025-10-27 12:00:00,Me siento realmente complacido con la funcionalidades; la uso a diario.,I am truly pleased with the funcionalidades of the bicicleta.,es,love,love,0.927637,True
2025-10-27 12:00:00,Estoy muy satisfecho con la atención y la consumo energético ofrecida por la empresa.,I am very satisfied with the consumo energético of the auriculares.,es,love,love,0.966003,True
2025-10-27 12:00:00,Admiro la calidad del hotel y su impecable relación calidad-precio.,I admire the relación calidad-precio of the hotel.,es,love,love,0.917226,True
2025-10-27 12:00:00,Estoy muy satisfecho con la atención y la rendimiento ofrecida por la empresa.,I am very satisfied with the rendimiento of the microondas.,es,love,love,0.946399,True
2025-10-27 12:00:00,Me encanta la duración de batería de este cafetera; ha superado mis expectativas.,I love the duración de batería of the cafetera.,es,love,love,0.975062,True
2025-10-27 12:00:00,Me encanta la calidad de sonido de este crema facial; ha superado mis expectativas.,I love the calidad de sonido of the crema facial.,es,love,love,0.958775,True
2025-10-27 12:00:00,Me encanta la estabilidad de este soporte técnico; ha superado mis expectativas.,I love the estabilidad of the soporte técnico.,es,love,love,0.954351,True
2025-10-27 12:00:00,Valoro mucho la precisión y la fiabilidad del plataforma de cursos.,I highly value the precisión of the plataforma de cursos.,es,love,love,0.908072,True
2025-10-27 12:00:00,Valoro mucho la estabilidad y la fiabilidad del lavadora.,I highly value the estabilidad of the lavadora.,es,love,love,0.970979,True
2025-10-27 12:00:00,Valoro mucho la duración de batería y la fiabilidad del tablet.,I highly value the duración de batería of the tablet.,es,love,love,0.961907,True
2025-10-27 12:00:00,Recomendaría el almohada por su notable acabado sin dudarlo.,Recomendaría the almohada por su notable acabado sin dudarlo..,es,love,love,0.982022,True
2025-10-27 12:00:00,Valoro mucho la privacidad y la fiabilidad del nevera.,I highly value the privacidad of the nevera.,es,love,love,0.909929,True
2025-10-27 12:00:00,Recomendaría el televisor por su notable duración de batería sin dudarlo.,Recomendaría the televisor por su notable duración de batería sin dudarlo..,es,love,love,0.980724,True
2025-10-27 12:00:00,Estoy muy satisfecho con la atención y la estabilidad ofrecida por la empresa.,I am very satisfied with the estabilidad of the bicicleta.,es,love,love,0.915252,True
2025-10-27 12:00:00,Recomendaría el colchón por su notable facilidad de uso sin dudarlo.,Recomendaría the colchón por su notable facilidad de uso sin dudarlo..,es,love,love,0.906648,True
2025-10-27 12:00:00,Admiro la calidad del smartwatch y su impecable estabilidad.,I admire the estabilidad of the smartwatch.,es,love,love,0.954901,True
2025-10-27 12:00:00,Este servicio me ha ganado por su excelente calidad de sonido.,Este servicio me ha ganado por su excelente calidad de sonido..,es,love,love,0.974285,True
2025-10-27 12:00:00,Valoro mucho la puntualidad y la fiabilidad del nevera.,I highly value the puntualidad of the nevera.,es,love,love,0.911069,True
2025-10-27 12:00:00,Admiro la calidad del nevera y su impecable resolución de pantalla.,I admire the resolución de pantalla of the nevera.,es,love,love,0.944801,True
2025-10-27 12:00:00,Admiro la calidad del lavadora y su impecable durabilidad.,I admire the durabilidad of the lavadora.,es,love,love,0.902802,True
2025-10-27 12:00:00,Valoro mucho la servicio postventa y la fiabilidad del ventilador.,I highly value the servicio postventa of the ventilador.,es,love,love,0.970993,True
2025-10-27 12:00:00,Me siento realmente complacido con la estabilidad; la uso a diario.,I am truly pleased with the estabilidad of the app bancaria.,es,love,love,0.977933,True
2025-10-27 12:00:00,Valoro mucho la facilidad de uso y la fiabilidad del compañía de telecomunicaciones.,I highly value the facilidad de uso of the compañía de telecomunicaciones.,es,love,love,0.945023,True
2025-10-27 12:00:00,Valoro mucho la seguridad y la fiabilidad del estufa.,I highly value the seguridad of the estufa.,es,love,love,0.900339,True
2025-10-27 12:00:00,Me encanta la resolución de pantalla de este lavadora; ha superado mis expectativas.,I love the resolución de pantalla of the lavadora.,es,love,love,0.934392,True
2025-10-27 12:00:00,Me encanta la estabilidad de este mochila; ha superado mis expectativas.,I love the estabilidad of the mochila.,es,love,love,0.918922,True
2025-10-27 12:00:00,Recomendaría el estufa por su notable seguridad sin dudarlo.,Recomendaría the estufa por su notable seguridad sin dudarlo..,es,love,love,0.969242,True
2025-10-27 12:00:00,Admiro la calidad del router y su impecable relación calidad-precio.,I admire the relación calidad-precio of the router.,es,love,love,0.98503,True
2025-10-27 12:00:00,Estoy muy satisfecho con la atención y la interfaz ofrecida por la empresa.,I am very satisfied with the interfaz of the restaurante.,es,love,love,0.912779,True
2025-10-27 12:00:00,Admiro la calidad del calefactor y su impecable rendimiento.,I admire the rendimiento of the calefactor.,es,love,love,0.955913,True
2025-10-27 12:00:00,Valoro mucho la sensibilidad y la fiabilidad del router.,I highly value the sensibilidad of the router.,es,love,love,0.903577,True
2025-10-27 12:00:00,Este servicio me ha ganado por su excelente consumo energético.,Este servicio me ha ganado por su excelente consumo energético..,es,love,love,0.933025,True
2025-10-27 12:00:00,Valoro mucho la privacidad y la fiabilidad del compañía de telecomunicaciones.,I highly value the privacidad of the compañía de telecomunicaciones.,es,love,love,0.92666,True
2025-10-27 12:00:00,Recomendaría el calefactor por su notable conectividad sin dudarlo.,Recomendaría the calefactor por su notable conectividad sin dudarlo..,es,love,love,0.935296,True
2025-10-27 12:00:00,Admiro la calidad del almohada y su impecable funcionalidades.,I admire the funcionalidades of the almohada.,es,love,love,0.910426,True
2025-10-27 12:00:00,Recomendaría el estufa por su notable relación calidad-precio sin dudarlo.,Recomendaría the estufa por su notable relación calidad-precio sin dudarlo..,es,love,love,0.904603,True
2025-10-27 12:00:00,Admiro la calidad del televisor y su impecable compatibilidad.,I admire the compatibilidad of the televisor.,es,love,love,0.972016,True
2025-10-27 12:00:00,Valoro mucho la acabado y la fiabilidad del televisor.,I highly value the acabado of the televisor.,es,love,love,0.942019,True
2025-10-27 12:00:00,Valoro mucho la material y la fiabilidad del detergente.,I highly value the material of the detergente.,es,love,love,0.929092,True
2025-10-27 12:00:00,Recomendaría el colchón por su notable garantía sin dudarlo.,Recomendaría the colchón por su notable garantía sin dudarlo..,es,love,love,0.916623,True
2025-10-27 12:00:00,Estoy muy satisfecho con la atención y la rendimiento ofrecida por la empresa.,I am very satisfied with the rendimiento of the monitor.,es,love,love,0.913302,True
2025-10-27 12:00:00,Recomendaría el maleta por su notable seguridad sin dudarlo.,Recomendaría the maleta por su notable seguridad sin dudarlo..,es,love,love,0.947953,True
2025-10-27 12:00:00,Este servicio me ha ganado por su excelente servicio postventa.,Este servicio me ha ganado por su excelente servicio postventa..,es,love,love,0.912757,True
2025-10-27 12:00:00,Recomendaría el colchón por su notable entrega sin dudarlo.,Recomendaría the colchón por su notable entrega sin dudarlo..,es,love,love,0.985651,True
2025-10-27 12:00:00,Valoro mucho la facilidad de uso y la fiabilidad del router.,I highly value the facilidad de uso of the router.,es,love,love,0.947382,True
2025-10-27 12:00:00,Estoy muy satisfecho con la atención y la consumo energético ofrecida por la empresa.,I am very satisfied with the consumo energético of the smartwatch.,es,love,love,0.93711,True
2025-10-27 12:00:00,Me encanta la entrega de este maleta; ha superado mis expectativas.,I love the entrega of the maleta.,es,love,love,0.926898,True
2025-10-27 12:00:00,Me encanta la relación calidad-precio de este detergente; ha superado mis expectativas.,I love the relación calidad-precio of the detergente.,es,love,love,0.92975,True
2025-10-27 12:00:00,Valoro mucho la consumo energético y la fiabilidad del maleta.,I highly value the consumo energético of the maleta.,es,love,love,0.944331,True
2025-10-27 12:00:00,Me encanta la experiencia de usuario de este tablet; ha superado mis expectativas.,I love the experiencia de usuario of the tablet.,es,love,love,0.962873,True
2025-10-27 12:00:00,Estoy muy satisfecho con la atención y la material ofrecida por la empresa.,I am very satisfied with the material of the impresora.,es,love,love,0.968552,True
2025-10-27 12:00:00,Me encanta la velocidad de este lavadora; ha superado mis expectativas.,I love the velocidad of the lavadora.,es,love,love,0.981944,True
2025-10-27 12:00:00,Admiro la calidad del chaqueta y su impecable calidad de sonido.,I admire the calidad de sonido of the chaqueta.,es,love,love,0.981307,True
2025-10-27 12:00:00,Me siento realmente complacido con la durabilidad; la uso a diario.,I am truly pleased with the durabilidad of the app bancaria.,es,love,love,0.980245,True
2025-10-27 12:00:00,Valoro mucho la calidad de sonido y la fiabilidad del soporte técnico.,I highly value the calidad de sonido of the soporte técnico.,es,love,love,0.948127,True
2025-10-27 12:00:00,Me siento realmente complacido con la estabilidad; la uso a diario.,I am truly pleased with the estabilidad of the compañía de telecomunicaciones.,es,love,love,0.941494,True
2025-10-27 12:00:00,Admiro la calidad del reloj inteligente y su impecable entrega.,I admire the entrega of the reloj inteligente.,es,love,love,0.972126,True
2025-10-27 12:00:00,Me encanta la durabilidad de este altavoz; ha superado mis expectativas.,I love the durabilidad of the altavoz.,es,love,love,0.959362,True
2025-10-27 12:00:00,Estoy muy satisfecho con la atención y la precisión ofrecida por la empresa.,I am very satisfied with the precisión of the aspiradora.,es,love,love,0.948911,True
2025-10-27 12:00:00,Me encanta la consumo energético de este smartwatch; ha superado mis expectativas.,I love the consumo energético of the smartwatch.,es,love,love,0.956747,True
2025-10-27 12:00:00,Me encanta la capacidad de carga de este restaurante; ha superado mis expectativas.,I love the capacidad de carga of the restaurante.,es,love,love,0.937963,True
2025-10-27 12:00:00,Recomendaría el servicio de streaming por su notable consumo energético sin dudarlo.,Recomendaría the servicio de streaming por su notable consumo energético sin dudarlo..,es,love,love,0.920909,True
2025-10-27 12:00:00,Me encanta la compatibilidad de este lavadora; ha superado mis expectativas.,I love the compatibilidad of the lavadora.,es,love,love,0.908386,True
2025-10-27 12:00:00,Estoy muy satisfecho con la atención y la compatibilidad ofrecida por la empresa.,I am very satisfied with the compatibilidad of the router.,es,love,love,0.916681,True
2025-10-27 12:00:00,Este servicio me ha ganado por su excelente garantía.,Este servicio me ha ganado por su excelente garantía..,es,love,love,0.968176,True
2025-10-27 12:00:00,Admiro la calidad del hotel y su impecable capacidad de carga.,I admire the capacidad de carga of the hotel.,es,love,love,0.931154,True
2025-10-27 12:00:00,Admiro la calidad del router y su impecable velocidad.,I admire the velocidad of the router.,es,love,love,0.958015,True
2025-10-27 12:00:00,Estoy muy satisfecho con la atención y la material ofrecida por la empresa.,I am very satisfied with the material of the router.,es,love,love,0.958546,True
2025-10-27 12:00:00,Valoro mucho la resolución de pantalla y la fiabilidad del hotel.,I highly value the resolución de pantalla of the hotel.,es,love,love,0.94723,True
2025-10-27 12:00:00,Admiro la calidad del monitor y su impecable estabilidad.,I admire the estabilidad of the monitor.,es,love,love,0.934684,True
2025-10-27 12:00:00,Estoy muy satisfecho con la atención y la servicio postventa ofrecida por la empresa.,I am very satisfied with the servicio postventa of the aspiradora.,es,love,love,0.955027,True
