timestamp,texto_original,texto_traducido,idioma,emocion_predicha,emocion_correcta,confianza,es_correcto
2025-10-27 12:46:02,Estoy muy feliz,I am very happy,es,joy,joy,0.95,True
2025-10-27 12:52:51,Hoy me siento lleno de energía positiva.,Today I feel full of positive energy.,es,joy,joy,0.9498186491602616,True
2025-10-27 12:53:13,Me siento vacío por dentro.,I feel empty inside.,es,sad,sad,0.9574107911718798,True
2025-10-27 12:53:25,¡Estoy cansado de que nadie me escuche!,I'm tired of no one listening to me!,es,anger,anger,0.4622387268504481,True
2025-10-27 12:53:41,Tengo miedo de que algo salga mal.,I'm afraid something will go wrong.,es,fear,fear,0.9164687205991688,True
2025-10-27 12:53:54,Me encanta cómo me haces sentir.,I love how you make me feel.,es,joy,love,0.5803076378278804,False
2025-10-27 12:54:18,¡No puedo creer lo que acabo de escuchar!,I can't believe what I just heard!,es,anger,suprise,0.3699927782792374,False
2025-10-27 12:57:38,¡Qué felicidad ver cómo todo sale bien!,What happiness to see how everything turns out well!,es,joy,joy,0.75412929743631,True
2025-10-27 12:57:49,"No puedo dejar de sonreír, estoy muy contento.","I can't stop smiling, I'm very happy.",es,joy,joy,0.7830309982640953,True
2025-10-27 12:57:59,Ganamos el campeonato y fue increíble.,We won the championship and it was incredible.,es,joy,joy,0.3789669964532928,True
2025-10-27 12:58:11,No puedo dejar de pensar en lo que perdí.,I can't stop thinking about what I lost.,es,sad,sad,0.7811297364020724,True
2025-10-27 12:58:24,Estos días han sido muy difíciles para mí.,These days have been very difficult for me.,es,anger,sad,0.3742481360156313,False
2025-10-27 12:59:49,Todo parece gris últimamente.,Everything seems gray lately.,es,anger,sad,0.4201983322285766,False
2025-10-27 13:00:16,Me duele ver cómo las cosas cambiaron tanto.,It hurts me to see how things have changed so much.,es,anger,sad,0.4337402158432226,False
2025-10-27 13:00:29,No soporto cuando me tratan con tanta falta de respeto.,I can't stand it when they treat me with so much disrespect.,es,anger,anger,0.3492657665760503,True
2025-10-27 13:00:40,Me enoja mucho su actitud arrogante.,His arrogant attitude makes me very angry.,es,anger,anger,0.9655952802275954,True
2025-10-27 13:00:50,Esto es completamente injusto,This is completely unfair,es,joy,anger,0.3666386028472853,False
2025-10-27 13:01:08,Me preocupa no estar listo para lo que viene.,I worry that I'm not ready for what's coming.,es,joy,fear,0.4390331068538732,False
2025-10-27 13:01:19,"No quiero fallar, eso me aterra.","I don't want to fail, that terrifies me.",es,joy,fear,0.3158525325963829,False
2025-10-27 13:01:31,Escuché un ruido extraño y me asusté.,I heard a strange noise and I got scared.,es,fear,fear,0.8534870356993298,True
2025-10-27 13:01:43,Me da pánico hablar frente a tanta gente.,I'm scared to speak in front of so many people.,es,fear,fear,0.8513285623554829,True
2025-10-27 13:01:55,Te amo más de lo que puedo expresar.,I love you more than I can express.,es,joy,love,0.5297710075286162,False
2025-10-27 13:02:05,Cada día contigo es un regalo.,Every day with you is a gift.,es,joy,love,0.4194096196265526,False
2025-10-27 13:02:18,"¡Wow, eso sí que me tomó por sorpresa!","Wow, that really took me by surprise!",es,joy,suprise,0.3287587651407557,False
2025-10-27 13:02:29,Jamás imaginé que algo así pasaría.,I never imagined something like this would happen.,es,anger,suprise,0.399539098933549,False
2025-10-27 13:02:41,¡Qué increíble giro de los acontecimientos!,What an incredible turn of events!,es,joy,suprise,0.3670032092318869,False
2025-10-27 12:00:00,Siento ansiedad por la seguridad y la calidad de sonido del servicio que ofrecen.,I feel anxious about the calidad de sonido of the nevera.,es,fear,fear,0.964112,True
2025-10-27 12:00:00,Estoy inquieto por la posibilidad de que el altavoz tenga problemas en la garantía.,I am uneasy about the garantía of the altavoz.,es,fear,fear,0.925483,True
2025-10-27 12:00:00,Tengo dudas sobre la facilidad de uso del lavadora y no sé si invertir en él.,I have doubts about the facilidad de uso of the lavadora.,es,fear,fear,0.985127,True
2025-10-27 12:00:00,No me inspira confianza la información sobre la rendimiento del altavoz.,It does not inspire confidence in the rendimiento of the altavoz.,es,fear,fear,0.940433,True
2025-10-27 12:00:00,"Temo que, tras un par de usos, la actualizaciones del monitor deje de funcionar.",I fear that the actualizaciones of the monitor.,es,fear,fear,0.923079,True
2025-10-27 12:00:00,Siento ansiedad por la seguridad y la puntualidad del servicio que ofrecen.,I feel anxious about the puntualidad of the tablet.,es,fear,fear,0.954127,True
2025-10-27 12:00:00,No me inspira confianza la información sobre la atención al cliente del hotel.,It does not inspire confidence in the atención al cliente of the hotel.,es,fear,fear,0.937932,True
2025-10-27 12:00:00,Me preocupa la interfaz de este televisor; temo que falle en poco tiempo.,I am concerned about the interfaz of the televisor.,es,fear,fear,0.90271,True
2025-10-27 12:00:00,Me preocupa la entrega de este tablet; temo que falle en poco tiempo.,I am concerned about the entrega of the tablet.,es,fear,fear,0.950266,True
2025-10-27 12:00:00,Me preocupa la relación calidad-precio de este taxi; temo que falle en poco tiempo.,I am concerned about the relación calidad-precio of the taxi.,es,fear,fear,0.935612,True
2025-10-27 12:00:00,Siento ansiedad por la seguridad y la acabado del servicio que ofrecen.,I feel anxious about the acabado of the lavadora.,es,fear,fear,0.979337,True
2025-10-27 12:00:00,Estoy inquieto por la posibilidad de que el compañía de telecomunicaciones tenga problemas en la conectividad.,I am uneasy about the conectividad of the compañía de telecomunicaciones.,es,fear,fear,0.94328,True
2025-10-27 12:00:00,Me da miedo que la calidad de sonido del nevera sea insuficiente para mi familia.,I am afraid that the calidad de sonido of the nevera.,es,fear,fear,0.936297,True
2025-10-27 12:00:00,Siento ansiedad por la seguridad y la compatibilidad del servicio que ofrecen.,I feel anxious about the compatibilidad of the calefactor.,es,fear,fear,0.915314,True
2025-10-27 12:00:00,No me inspira confianza la información sobre la durabilidad del soporte técnico.,It does not inspire confidence in the durabilidad of the soporte técnico.,es,fear,fear,0.917569,True
2025-10-27 12:00:00,"Temo que, tras un par de usos, la estabilidad del soporte técnico deje de funcionar.",I fear that the estabilidad of the soporte técnico.,es,fear,fear,0.912374,True
2025-10-27 12:00:00,No me inspira confianza la información sobre la duración de batería del cafetera.,It does not inspire confidence in the duración de batería of the cafetera.,es,fear,fear,0.982103,True
2025-10-27 12:00:00,Me preocupa la relación calidad-precio de este chaqueta; temo que falle en poco tiempo.,I am concerned about the relación calidad-precio of the chaqueta.,es,fear,fear,0.908835,True
2025-10-27 12:00:00,Tengo dudas sobre la consumo energético del plancha y no sé si invertir en él.,I have doubts about the consumo energético of the plancha.,es,fear,fear,0.908193,True
2025-10-27 12:00:00,Tengo dudas sobre la actualizaciones del smartwatch y no sé si invertir en él.,I have doubts about the actualizaciones of the smartwatch.,es,fear,fear,0.968891,True
2025-10-27 12:00:00,Tengo dudas sobre la puntualidad del auriculares y no sé si invertir en él.,I have doubts about the puntualidad of the auriculares.,es,fear,fear,0.958579,True
2025-10-27 12:00:00,Me preocupa la rendimiento de este microondas; temo que falle en poco tiempo.,I am concerned about the rendimiento of the microondas.,es,fear,fear,0.951828,True
2025-10-27 12:00:00,No me inspira confianza la información sobre la resolución de pantalla del taxi.,It does not inspire confidence in the resolución de pantalla of the taxi.,es,fear,fear,0.975492,True
2025-10-27 12:00:00,Me da miedo que la material del smartwatch sea insuficiente para mi familia.,I am afraid that the material of the smartwatch.,es,fear,fear,0.912181,True
2025-10-27 12:00:00,Estoy inquieto por la posibilidad de que el smartwatch tenga problemas en la diseño.,I am uneasy about the diseño of the smartwatch.,es,fear,fear,0.906414,True
2025-10-27 12:00:00,"Temo que, tras un par de usos, la relación calidad-precio del taxi deje de funcionar.",I fear that the relación calidad-precio of the taxi.,es,fear,fear,0.976782,True
2025-10-27 12:00:00,"Temo que, tras un par de usos, la velocidad del maleta deje de funcionar.",I fear that the velocidad of the maleta.,es,fear,fear,0.982501,True
2025-10-27 12:00:00,Tengo dudas sobre la entrega del app bancaria y no sé si invertir en él.,I have doubts about the entrega of the app bancaria.,es,fear,fear,0.96782,True
2025-10-27 12:00:00,Siento ansiedad por la seguridad y la acabado del servicio que ofrecen.,I feel anxious about the acabado of the monitor.,es,fear,fear,0.981636,True
2025-10-27 12:00:00,"Temo que, tras un par de usos, la garantía del microondas deje de funcionar.",I fear that the garantía of the microondas.,es,fear,fear,0.939812,True
2025-10-27 12:00:00,No me inspira confianza la información sobre la consumo energético del teléfono.,It does not inspire confidence in the consumo energético of the teléfono.,es,fear,fear,0.961047,True
2025-10-27 12:00:00,No me inspira confianza la información sobre la capacidad de carga del reloj inteligente.,It does not inspire confidence in the capacidad de carga of the reloj inteligente.,es,fear,fear,0.904667,True
2025-10-27 12:00:00,Me da miedo que la privacidad del reloj inteligente sea insuficiente para mi familia.,I am afraid that the privacidad of the reloj inteligente.,es,fear,fear,0.976651,True
2025-10-27 12:00:00,Siento ansiedad por la seguridad y la comodidad del servicio que ofrecen.,I feel anxious about the comodidad of the ventilador.,es,fear,fear,0.973804,True
2025-10-27 12:00:00,Siento ansiedad por la seguridad y la conectividad del servicio que ofrecen.,I feel anxious about the conectividad of the app bancaria.,es,fear,fear,0.96642,True
2025-10-27 12:00:00,No me inspira confianza la información sobre la entrega del hotel.,It does not inspire confidence in the entrega of the hotel.,es,fear,fear,0.974714,True
2025-10-27 12:00:00,Me preocupa la seguridad de este altavoz; temo que falle en poco tiempo.,I am concerned about the seguridad of the altavoz.,es,fear,fear,0.920099,True
2025-10-27 12:00:00,Siento ansiedad por la seguridad y la servicio postventa del servicio que ofrecen.,I feel anxious about the servicio postventa of the soporte técnico.,es,fear,fear,0.972085,True
2025-10-27 12:00:00,Siento ansiedad por la seguridad y la interfaz del servicio que ofrecen.,I feel anxious about the interfaz of the televisor.,es,fear,fear,0.971964,True
2025-10-27 12:00:00,Tengo dudas sobre la conectividad del cafetera y no sé si invertir en él.,I have doubts about the conectividad of the cafetera.,es,fear,fear,0.918025,True
2025-10-27 12:00:00,No me inspira confianza la información sobre la seguridad del almohada.,It does not inspire confidence in the seguridad of the almohada.,es,fear,fear,0.912014,True
2025-10-27 12:00:00,Estoy inquieto por la posibilidad de que el cafetera tenga problemas en la compatibilidad.,I am uneasy about the compatibilidad of the cafetera.,es,fear,fear,0.965953,True
2025-10-27 12:00:00,Siento ansiedad por la seguridad y la rendimiento del servicio que ofrecen.,I feel anxious about the rendimiento of the maleta.,es,fear,fear,0.975039,True
2025-10-27 12:00:00,No me inspira confianza la información sobre la material del firma de lavandería.,It does not inspire confidence in the material of the firma de lavandería.,es,fear,fear,0.965908,True
2025-10-27 12:00:00,Me da miedo que la calidad de sonido del smartwatch sea insuficiente para mi familia.,I am afraid that the calidad de sonido of the smartwatch.,es,fear,fear,0.910218,True
2025-10-27 12:00:00,Tengo dudas sobre la atención al cliente del impresora y no sé si invertir en él.,I have doubts about the atención al cliente of the impresora.,es,fear,fear,0.901932,True
2025-10-27 12:00:00,No me inspira confianza la información sobre la seguridad del soporte técnico.,It does not inspire confidence in the seguridad of the soporte técnico.,es,fear,fear,0.969644,True
2025-10-27 12:00:00,Tengo dudas sobre la rendimiento del plancha y no sé si invertir en él.,I have doubts about the rendimiento of the plancha.,es,fear,fear,0.9898,True
2025-10-27 12:00:00,No me inspira confianza la información sobre la atención al cliente del silla ergonómica.,It does not inspire confidence in the atención al cliente of the silla ergonómica.,es,fear,fear,0.913223,True
2025-10-27 12:00:00,Siento ansiedad por la seguridad y la acabado del servicio que ofrecen.,I feel anxious about the acabado of the nevera.,es,fear,fear,0.987689,True
2025-10-27 12:00:00,Me da miedo que la facilidad de uso del ventilador sea insuficiente para mi familia.,I am afraid that the facilidad de uso of the ventilador.,es,fear,fear,0.931426,True
2025-10-27 12:00:00,No me inspira confianza la información sobre la interfaz del bicicleta.,It does not inspire confidence in the interfaz of the bicicleta.,es,fear,fear,0.955857,True
2025-10-27 12:00:00,"Temo que, tras un par de usos, la resolución de pantalla del restaurante deje de funcionar.",I fear that the resolución de pantalla of the restaurante.,es,fear,fear,0.916412,True
2025-10-27 12:00:00,Me preocupa la garantía de este tablet; temo que falle en poco tiempo.,I am concerned about the garantía of the tablet.,es,fear,fear,0.908845,True
2025-10-27 12:00:00,Me da miedo que la comodidad del app bancaria sea insuficiente para mi familia.,I am afraid that the comodidad of the app bancaria.,es,fear,fear,0.961063,True
2025-10-27 12:00:00,Me da miedo que la diseño del agencia de viajes sea insuficiente para mi familia.,I am afraid that the diseño of the agencia de viajes.,es,fear,fear,0.960339,True
2025-10-27 12:00:00,Siento ansiedad por la seguridad y la garantía del servicio que ofrecen.,I feel anxious about the garantía of the taller mecánico.,es,fear,fear,0.971326,True
2025-10-27 12:00:00,"Temo que, tras un par de usos, la calidad de sonido del tablet deje de funcionar.",I fear that the calidad de sonido of the tablet.,es,fear,fear,0.96814,True
2025-10-27 12:00:00,Me preocupa la conectividad de este taxi; temo que falle en poco tiempo.,I am concerned about the conectividad of the taxi.,es,fear,fear,0.957433,True
2025-10-27 12:00:00,Estoy inquieto por la posibilidad de que el tablet tenga problemas en la velocidad.,I am uneasy about the velocidad of the tablet.,es,fear,fear,0.942096,True
2025-10-27 12:00:00,Tengo dudas sobre la material del auriculares y no sé si invertir en él.,I have doubts about the material of the auriculares.,es,fear,fear,0.968442,True
2025-10-27 12:00:00,Me preocupa la garantía de este plataforma de cursos; temo que falle en poco tiempo.,I am concerned about the garantía of the plataforma de cursos.,es,fear,fear,0.926945,True
2025-10-27 12:00:00,No me inspira confianza la información sobre la funcionalidades del nevera.,It does not inspire confidence in the funcionalidades of the nevera.,es,fear,fear,0.982013,True
2025-10-27 12:00:00,Me preocupa la conectividad de este altavoz; temo que falle en poco tiempo.,I am concerned about the conectividad of the altavoz.,es,fear,fear,0.987414,True
2025-10-27 12:00:00,Me preocupa la puntualidad de este app bancaria; temo que falle en poco tiempo.,I am concerned about the puntualidad of the app bancaria.,es,fear,fear,0.918911,True
2025-10-27 12:00:00,No me inspira confianza la información sobre la estabilidad del soporte técnico.,It does not inspire confidence in the estabilidad of the soporte técnico.,es,fear,fear,0.927496,True
2025-10-27 12:00:00,"Temo que, tras un par de usos, la puntualidad del restaurante deje de funcionar.",I fear that the puntualidad of the restaurante.,es,fear,fear,0.969995,True
2025-10-27 12:00:00,Siento ansiedad por la seguridad y la consumo energético del servicio que ofrecen.,I feel anxious about the consumo energético of the auriculares.,es,fear,fear,0.978603,True
2025-10-27 12:00:00,Me da miedo que la privacidad del monitor sea insuficiente para mi familia.,I am afraid that the privacidad of the monitor.,es,fear,fear,0.934149,True
2025-10-27 12:00:00,Me preocupa la actualizaciones de este agencia de viajes; temo que falle en poco tiempo.,I am concerned about the actualizaciones of the agencia de viajes.,es,fear,fear,0.905422,True
2025-10-27 12:00:00,Tengo dudas sobre la seguridad del silla ergonómica y no sé si invertir en él.,I have doubts about the seguridad of the silla ergonómica.,es,fear,fear,0.900188,True
2025-10-27 12:00:00,Estoy inquieto por la posibilidad de que el monitor tenga problemas en la experiencia de usuario.,I am uneasy about the experiencia de usuario of the monitor.,es,fear,fear,0.90405,True
2025-10-27 12:00:00,Me da miedo que la actualizaciones del licuadora sea insuficiente para mi familia.,I am afraid that the actualizaciones of the licuadora.,es,fear,fear,0.964298,True
2025-10-27 12:00:00,Me preocupa la material de este colchón; temo que falle en poco tiempo.,I am concerned about the material of the colchón.,es,fear,fear,0.97035,True
2025-10-27 12:00:00,"Temo que, tras un par de usos, la servicio postventa del mochila deje de funcionar.",I fear that the servicio postventa of the mochila.,es,fear,fear,0.941834,True
2025-10-27 12:00:00,Tengo dudas sobre la seguridad del lavadora y no sé si invertir en él.,I have doubts about the seguridad of the lavadora.,es,fear,fear,0.912905,True
2025-10-27 12:00:00,Me da miedo que la facilidad de uso del chaqueta sea insuficiente para mi familia.,I am afraid that the facilidad de uso of the chaqueta.,es,fear,fear,0.924754,True
2025-10-27 12:00:00,Siento ansiedad por la seguridad y la conectividad del servicio que ofrecen.,I feel anxious about the conectividad of the mochila.,es,fear,fear,0.967256,True
2025-10-27 12:00:00,Tengo dudas sobre la material del servicio de streaming y no sé si invertir en él.,I have doubts about the material of the servicio de streaming.,es,fear,fear,0.90076,True
2025-10-27 12:00:00,Tengo dudas sobre la relación calidad-precio del servicio de streaming y no sé si invertir en él.,I have doubts about the relación calidad-precio of the servicio de streaming.,es,fear,fear,0.944707,True
2025-10-27 12:00:00,Tengo dudas sobre la puntualidad del silla ergonómica y no sé si invertir en él.,I have doubts about the puntualidad of the silla ergonómica.,es,fear,fear,0.965069,True
2025-10-27 12:00:00,Me preocupa la privacidad de este maleta; temo que falle en poco tiempo.,I am concerned about the privacidad of the maleta.,es,fear,fear,0.93324,True
2025-10-27 12:00:00,"Temo que, tras un par de usos, la garantía del crema facial deje de funcionar.",I fear that the garantía of the crema facial.,es,fear,fear,0.969086,True
2025-10-27 12:00:00,Tengo dudas sobre la interfaz del hotel y no sé si invertir en él.,I have doubts about the interfaz of the hotel.,es,fear,fear,0.967936,True
2025-10-27 12:00:00,Estoy inquieto por la posibilidad de que el licuadora tenga problemas en la seguridad.,I am uneasy about the seguridad of the licuadora.,es,fear,fear,0.966193,True
2025-10-27 12:00:00,Estoy inquieto por la posibilidad de que el soporte técnico tenga problemas en la acabado.,I am uneasy about the acabado of the soporte técnico.,es,fear,fear,0.951796,True
2025-10-27 12:00:00,Siento ansiedad por la seguridad y la precisión del servicio que ofrecen.,I feel anxious about the precisión of the nevera.,es,fear,fear,0.906761,True
2025-10-27 12:00:00,Me da miedo que la seguridad del compañía de telecomunicaciones sea insuficiente para mi familia.,I am afraid that the seguridad of the compañía de telecomunicaciones.,es,fear,fear,0.963258,True
2025-10-27 12:00:00,Tengo dudas sobre la calidad de sonido del silla ergonómica y no sé si invertir en él.,I have doubts about the calidad de sonido of the silla ergonómica.,es,fear,fear,0.941275,True
2025-10-27 12:00:00,Siento ansiedad por la seguridad y la relación calidad-precio del servicio que ofrecen.,I feel anxious about the relación calidad-precio of the reloj inteligente.,es,fear,fear,0.901754,True
2025-10-27 12:00:00,Me preocupa la puntualidad de este plancha; temo que falle en poco tiempo.,I am concerned about the puntualidad of the plancha.,es,fear,fear,0.915145,True
2025-10-27 12:00:00,Siento ansiedad por la seguridad y la actualizaciones del servicio que ofrecen.,I feel anxious about the actualizaciones of the hotel.,es,fear,fear,0.917293,True
2025-10-27 12:00:00,Tengo dudas sobre la diseño del taxi y no sé si invertir en él.,I have doubts about the diseño of the taxi.,es,fear,fear,0.95689,True
2025-10-27 12:00:00,Estoy inquieto por la posibilidad de que el hotel tenga problemas en la resolución de pantalla.,I am uneasy about the resolución de pantalla of the hotel.,es,fear,fear,0.937062,True
2025-10-27 12:00:00,Siento ansiedad por la seguridad y la durabilidad del servicio que ofrecen.,I feel anxious about the durabilidad of the plataforma de cursos.,es,fear,fear,0.973792,True
2025-10-27 12:00:00,Estoy inquieto por la posibilidad de que el maleta tenga problemas en la capacidad de carga.,I am uneasy about the capacidad de carga of the maleta.,es,fear,fear,0.965559,True
2025-10-27 12:00:00,Me preocupa la resolución de pantalla de este ventilador; temo que falle en poco tiempo.,I am concerned about the resolución de pantalla of the ventilador.,es,fear,fear,0.906977,True
2025-10-27 12:00:00,"Temo que, tras un par de usos, la actualizaciones del lavadora deje de funcionar.",I fear that the actualizaciones of the lavadora.,es,fear,fear,0.912225,True
2025-10-27 12:00:00,No me inspira confianza la información sobre la velocidad del nevera.,It does not inspire confidence in the velocidad of the nevera.,es,fear,fear,0.986485,True
2025-10-27 12:00:00,"Temo que, tras un par de usos, la interfaz del aspiradora deje de funcionar.",I fear that the interfaz of the aspiradora.,es,fear,fear,0.95865,True
2025-10-27 12:00:00,No me inspira confianza la información sobre la velocidad del colchón.,It does not inspire confidence in the velocidad of the colchón.,es,fear,fear,0.943037,True
2025-10-27 12:00:00,No me inspira confianza la información sobre la calidad de sonido del app bancaria.,It does not inspire confidence in the calidad de sonido of the app bancaria.,es,fear,fear,0.979697,True
2025-10-27 12:00:00,Estoy inquieto por la posibilidad de que el smartwatch tenga problemas en la capacidad de carga.,I am uneasy about the capacidad de carga of the smartwatch.,es,fear,fear,0.941422,True
2025-10-27 12:00:00,No me inspira confianza la información sobre la funcionalidades del plataforma de cursos.,It does not inspire confidence in the funcionalidades of the plataforma de cursos.,es,fear,fear,0.942327,True
2025-10-27 12:00:00,Estoy inquieto por la posibilidad de que el restaurante tenga problemas en la acabado.,I am uneasy about the acabado of the restaurante.,es,fear,fear,0.957275,True
2025-10-27 12:00:00,Siento ansiedad por la seguridad y la consumo energético del servicio que ofrecen.,I feel anxious about the consumo energético of the colchón.,es,fear,fear,0.900973,True
2025-10-27 12:00:00,"Temo que, tras un par de usos, la puntualidad del licuadora deje de funcionar.",I fear that the puntualidad of the licuadora.,es,fear,fear,0.945385,True
2025-10-27 12:00:00,Me preocupa la capacidad de carga de este plataforma de cursos; temo que falle en poco tiempo.,I am concerned about the capacidad de carga of the plataforma de cursos.,es,fear,fear,0.917421,True
2025-10-27 12:00:00,Estoy inquieto por la posibilidad de que el chaqueta tenga problemas en la resolución de pantalla.,I am uneasy about the resolución de pantalla of the chaqueta.,es,fear,fear,0.960589,True
2025-10-27 12:00:00,Estoy inquieto por la posibilidad de que el agencia de viajes tenga problemas en la interfaz.,I am uneasy about the interfaz of the agencia de viajes.,es,fear,fear,0.938026,True
2025-10-27 12:00:00,Siento ansiedad por la seguridad y la entrega del servicio que ofrecen.,I feel anxious about the entrega of the monitor.,es,fear,fear,0.955484,True
2025-10-27 12:00:00,Me da miedo que la acabado del teléfono sea insuficiente para mi familia.,I am afraid that the acabado of the teléfono.,es,fear,fear,0.936281,True
2025-10-27 12:00:00,Me preocupa la velocidad de este plancha; temo que falle en poco tiempo.,I am concerned about the velocidad of the plancha.,es,fear,fear,0.973537,True
2025-10-27 12:00:00,"Temo que, tras un par de usos, la capacidad de carga del detergente deje de funcionar.",I fear that the capacidad de carga of the detergente.,es,fear,fear,0.982478,True
2025-10-27 12:00:00,Me preocupa la sensibilidad de este microondas; temo que falle en poco tiempo.,I am concerned about the sensibilidad of the microondas.,es,fear,fear,0.908048,True
2025-10-27 12:00:00,Me preocupa la calidad de sonido de este cámara; temo que falle en poco tiempo.,I am concerned about the calidad de sonido of the cámara.,es,fear,fear,0.923442,True
2025-10-27 12:00:00,Tengo dudas sobre la relación calidad-precio del detergente y no sé si invertir en él.,I have doubts about the relación calidad-precio of the detergente.,es,fear,fear,0.906964,True
2025-10-27 12:00:00,Me da miedo que la acabado del agencia de viajes sea insuficiente para mi familia.,I am afraid that the acabado of the agencia de viajes.,es,fear,fear,0.936981,True
2025-10-27 12:00:00,Me preocupa la durabilidad de este monitor; temo que falle en poco tiempo.,I am concerned about the durabilidad of the monitor.,es,fear,fear,0.936785,True
