timestamp,texto_original,texto_traducido,idioma,emocion_predicha,emocion_correcta,confianza,es_correcto
2025-10-27 12:00:00,Siento frustración por la falta de respuesta ante problemas con la estabilidad.,I feel frustrated by the estabilidad of the teléfono.,es,anger,anger,0.983147,True
2025-10-27 12:00:00,"Estoy muy molesto con la atención, la consumo energético fue desastrosa.",I am very upset about the consumo energético of the zapatos.,es,anger,anger,0.979503,True
2025-10-27 12:00:00,Siento frustración por la falta de respuesta ante problemas con la atención al cliente.,I feel frustrated by the atención al cliente of the plancha.,es,anger,anger,0.945002,True
2025-10-27 12:00:00,Me irrita que el altavoz presente fallos constantes en la funcionalidades.,It irritates me that the funcionalidades of the altavoz.,es,anger,anger,0.972382,True
2025-10-27 12:00:00,Estoy harto de que la conectividad sea de tan baja calidad para lo que pagué.,I am fed up with the conectividad of the mochila.,es,anger,anger,0.930643,True
2025-10-27 12:00:00,"Estoy muy molesto con la atención, la capacidad de carga fue desastrosa.",I am very upset about the capacidad de carga of the silla ergonómica.,es,anger,anger,0.940231,True
2025-10-27 12:00:00,Me enfadó la mala entrega del nevera; no cumple lo prometido.,I was angered by the entrega of the nevera.,es,anger,anger,0.918224,True
2025-10-27 12:00:00,Estoy harto de que la compatibilidad sea de tan baja calidad para lo que pagué.,I am fed up with the compatibilidad of the ventilador.,es,anger,anger,0.986074,True
2025-10-27 12:00:00,"Estoy muy molesto con la atención, la interfaz fue desastrosa.",I am very upset about the interfaz of the plataforma de cursos.,es,anger,anger,0.911764,True
2025-10-27 12:00:00,Siento frustración por la falta de respuesta ante problemas con la comodidad.,I feel frustrated by the comodidad of the taller mecánico.,es,anger,anger,0.917898,True
2025-10-27 12:00:00,Siento frustración por la falta de respuesta ante problemas con la diseño.,I feel frustrated by the diseño of the aspiradora.,es,anger,anger,0.919348,True
2025-10-27 12:00:00,"Estoy muy molesto con la atención, la conectividad fue desastrosa.",I am very upset about the conectividad of the monitor.,es,anger,anger,0.950133,True
2025-10-27 12:00:00,Me enfadó la mala diseño del plataforma de cursos; no cumple lo prometido.,I was angered by the diseño of the plataforma de cursos.,es,anger,anger,0.91321,True
2025-10-27 12:00:00,Me enfadó la mala calidad de sonido del reloj inteligente; no cumple lo prometido.,I was angered by the calidad de sonido of the reloj inteligente.,es,anger,anger,0.97078,True
2025-10-27 12:00:00,Estoy harto de que la comodidad sea de tan baja calidad para lo que pagué.,I am fed up with the comodidad of the lavadora.,es,anger,anger,0.967,True
2025-10-27 12:00:00,Siento frustración por la falta de respuesta ante problemas con la garantía.,I feel frustrated by the garantía of the agencia de viajes.,es,anger,anger,0.959803,True
2025-10-27 12:00:00,Siento frustración por la falta de respuesta ante problemas con la material.,I feel frustrated by the material of the estufa.,es,anger,anger,0.924162,True
2025-10-27 12:00:00,Estoy harto de que la rendimiento sea de tan baja calidad para lo que pagué.,I am fed up with the rendimiento of the firma de lavandería.,es,anger,anger,0.927183,True
2025-10-27 12:00:00,Siento frustración por la falta de respuesta ante problemas con la duración de batería.,I feel frustrated by the duración de batería of the colchón.,es,anger,anger,0.976162,True
2025-10-27 12:00:00,Me irrita que el ventilador presente fallos constantes en la consumo energético.,It irritates me that the consumo energético of the ventilador.,es,anger,anger,0.916223,True
2025-10-27 12:00:00,Me enfadó la mala calidad de sonido del compañía de telecomunicaciones; no cumple lo prometido.,I was angered by the calidad de sonido of the compañía de telecomunicaciones.,es,anger,anger,0.975114,True
2025-10-27 12:00:00,Estoy harto de que la precisión sea de tan baja calidad para lo que pagué.,I am fed up with the precisión of the estufa.,es,anger,anger,0.935834,True
2025-10-27 12:00:00,Estoy harto de que la garantía sea de tan baja calidad para lo que pagué.,I am fed up with the garantía of the ventilador.,es,anger,anger,0.968345,True
2025-10-27 12:00:00,Estoy harto de que la conectividad sea de tan baja calidad para lo que pagué.,I am fed up with the conectividad of the licuadora.,es,anger,anger,0.908923,True
2025-10-27 12:00:00,Me irrita que el firma de lavandería presente fallos constantes en la consumo energético.,It irritates me that the consumo energético of the firma de lavandería.,es,anger,anger,0.982872,True
2025-10-27 12:00:00,Estoy harto de que la atención al cliente sea de tan baja calidad para lo que pagué.,I am fed up with the atención al cliente of the crema facial.,es,anger,anger,0.973134,True
2025-10-27 12:00:00,Me enfadó la mala entrega del firma de lavandería; no cumple lo prometido.,I was angered by the entrega of the firma de lavandería.,es,anger,anger,0.926401,True
2025-10-27 12:00:00,Estoy harto de que la relación calidad-precio sea de tan baja calidad para lo que pagué.,I am fed up with the relación calidad-precio of the licuadora.,es,anger,anger,0.965133,True
2025-10-27 12:00:00,Me enfadó la mala actualizaciones del router; no cumple lo prometido.,I was angered by the actualizaciones of the router.,es,anger,anger,0.988505,True
2025-10-27 12:00:00,"Estoy muy molesto con la atención, la estabilidad fue desastrosa.",I am very upset about the estabilidad of the tablet.,es,anger,anger,0.982674,True
2025-10-27 12:00:00,Siento frustración por la falta de respuesta ante problemas con la funcionalidades.,I feel frustrated by the funcionalidades of the taxi.,es,anger,anger,0.950876,True
2025-10-27 12:00:00,"Estoy muy molesto con la atención, la velocidad fue desastrosa.",I am very upset about the velocidad of the televisor.,es,anger,anger,0.961273,True
2025-10-27 12:00:00,"Estoy muy molesto con la atención, la acabado fue desastrosa.",I am very upset about the acabado of the auriculares.,es,anger,anger,0.936484,True
2025-10-27 12:00:00,Me irrita que el servicio de streaming presente fallos constantes en la resolución de pantalla.,It irritates me that the resolución de pantalla of the servicio de streaming.,es,anger,anger,0.915733,True
2025-10-27 12:00:00,Siento frustración por la falta de respuesta ante problemas con la garantía.,I feel frustrated by the garantía of the crema facial.,es,anger,anger,0.91783,True
2025-10-27 12:00:00,"Estoy muy molesto con la atención, la entrega fue desastrosa.",I am very upset about the entrega of the bicicleta.,es,anger,anger,0.976484,True
2025-10-27 12:00:00,Estoy harto de que la facilidad de uso sea de tan baja calidad para lo que pagué.,I am fed up with the facilidad de uso of the plataforma de cursos.,es,anger,anger,0.984479,True
2025-10-27 12:00:00,Estoy harto de que la garantía sea de tan baja calidad para lo que pagué.,I am fed up with the garantía of the compañía de telecomunicaciones.,es,anger,anger,0.914907,True
2025-10-27 12:00:00,Siento frustración por la falta de respuesta ante problemas con la conectividad.,I feel frustrated by the conectividad of the taxi.,es,anger,anger,0.965785,True
2025-10-27 12:00:00,Me irrita que el cafetera presente fallos constantes en la actualizaciones.,It irritates me that the actualizaciones of the cafetera.,es,anger,anger,0.987883,True
2025-10-27 12:00:00,Siento frustración por la falta de respuesta ante problemas con la precisión.,I feel frustrated by the precisión of the agencia de viajes.,es,anger,anger,0.920402,True
2025-10-27 12:00:00,"Estoy muy molesto con la atención, la puntualidad fue desastrosa.",I am very upset about the puntualidad of the ventilador.,es,anger,anger,0.977044,True
2025-10-27 12:00:00,Estoy harto de que la experiencia de usuario sea de tan baja calidad para lo que pagué.,I am fed up with the experiencia de usuario of the ventilador.,es,anger,anger,0.922508,True
2025-10-27 12:00:00,Siento frustración por la falta de respuesta ante problemas con la material.,I feel frustrated by the material of the bicicleta.,es,anger,anger,0.965346,True
2025-10-27 12:00:00,Me enfadó la mala diseño del calefactor; no cumple lo prometido.,I was angered by the diseño of the calefactor.,es,anger,anger,0.985436,True
2025-10-27 12:00:00,Me enfadó la mala funcionalidades del app bancaria; no cumple lo prometido.,I was angered by the funcionalidades of the app bancaria.,es,anger,anger,0.933633,True
2025-10-27 12:00:00,Estoy harto de que la velocidad sea de tan baja calidad para lo que pagué.,I am fed up with the velocidad of the microondas.,es,anger,anger,0.986126,True
2025-10-27 12:00:00,Me irrita que el nevera presente fallos constantes en la consumo energético.,It irritates me that the consumo energético of the nevera.,es,anger,anger,0.940673,True
2025-10-27 12:00:00,"Estoy muy molesto con la atención, la atención al cliente fue desastrosa.",I am very upset about the atención al cliente of the calefactor.,es,anger,anger,0.969589,True
2025-10-27 12:00:00,"Estoy muy molesto con la atención, la experiencia de usuario fue desastrosa.",I am very upset about the experiencia de usuario of the reloj inteligente.,es,anger,anger,0.921708,True
2025-10-27 12:00:00,Siento frustración por la falta de respuesta ante problemas con la facilidad de uso.,I feel frustrated by the facilidad de uso of the smartwatch.,es,anger,anger,0.978395,True
2025-10-27 12:00:00,Estoy harto de que la duración de batería sea de tan baja calidad para lo que pagué.,I am fed up with the duración de batería of the app bancaria.,es,anger,anger,0.966596,True
2025-10-27 12:00:00,Siento frustración por la falta de respuesta ante problemas con la sensibilidad.,I feel frustrated by the sensibilidad of the almohada.,es,anger,anger,0.933097,True
2025-10-27 12:00:00,Estoy harto de que la diseño sea de tan baja calidad para lo que pagué.,I am fed up with the diseño of the almohada.,es,anger,anger,0.922653,True
2025-10-27 12:00:00,Me irrita que el ventilador presente fallos constantes en la servicio postventa.,It irritates me that the servicio postventa of the ventilador.,es,anger,anger,0.962216,True
2025-10-27 12:00:00,Siento frustración por la falta de respuesta ante problemas con la puntualidad.,I feel frustrated by the puntualidad of the auriculares.,es,anger,anger,0.928585,True
2025-10-27 12:00:00,Siento frustración por la falta de respuesta ante problemas con la puntualidad.,I feel frustrated by the puntualidad of the altavoz.,es,anger,anger,0.922402,True
2025-10-27 12:00:00,Estoy harto de que la acabado sea de tan baja calidad para lo que pagué.,I am fed up with the acabado of the mochila.,es,anger,anger,0.943875,True
2025-10-27 12:00:00,Me enfadó la mala funcionalidades del taller mecánico; no cumple lo prometido.,I was angered by the funcionalidades of the taller mecánico.,es,anger,anger,0.983992,True
2025-10-27 12:00:00,"Estoy muy molesto con la atención, la entrega fue desastrosa.",I am very upset about the entrega of the detergente.,es,anger,anger,0.941657,True
2025-10-27 12:00:00,Estoy harto de que la actualizaciones sea de tan baja calidad para lo que pagué.,I am fed up with the actualizaciones of the envío.,es,anger,anger,0.962522,True
2025-10-27 12:00:00,Siento frustración por la falta de respuesta ante problemas con la privacidad.,I feel frustrated by the privacidad of the tablet.,es,anger,anger,0.919038,True
2025-10-27 12:00:00,"Estoy muy molesto con la atención, la atención al cliente fue desastrosa.",I am very upset about the atención al cliente of the soporte técnico.,es,anger,anger,0.954604,True
2025-10-27 12:00:00,Me enfadó la mala conectividad del licuadora; no cumple lo prometido.,I was angered by the conectividad of the licuadora.,es,anger,anger,0.946724,True
2025-10-27 12:00:00,Me irrita que el calefactor presente fallos constantes en la capacidad de carga.,It irritates me that the capacidad de carga of the calefactor.,es,anger,anger,0.958554,True
2025-10-27 12:00:00,"Estoy muy molesto con la atención, la actualizaciones fue desastrosa.",I am very upset about the actualizaciones of the taxi.,es,anger,anger,0.924241,True
2025-10-27 12:00:00,Me irrita que el bicicleta presente fallos constantes en la comodidad.,It irritates me that the comodidad of the bicicleta.,es,anger,anger,0.950999,True
2025-10-27 12:00:00,Siento frustración por la falta de respuesta ante problemas con la velocidad.,I feel frustrated by the velocidad of the taxi.,es,anger,anger,0.906601,True
2025-10-27 12:00:00,Siento frustración por la falta de respuesta ante problemas con la actualizaciones.,I feel frustrated by the actualizaciones of the servicio de streaming.,es,anger,anger,0.933692,True
2025-10-27 12:00:00,Me irrita que el cafetera presente fallos constantes en la privacidad.,It irritates me that the privacidad of the cafetera.,es,anger,anger,0.9315,True
2025-10-27 12:00:00,Me irrita que el colchón presente fallos constantes en la seguridad.,It irritates me that the seguridad of the colchón.,es,anger,anger,0.906033,True
2025-10-27 12:00:00,"Estoy muy molesto con la atención, la durabilidad fue desastrosa.",I am very upset about the durabilidad of the compañía de telecomunicaciones.,es,anger,anger,0.926817,True
2025-10-27 12:00:00,Estoy harto de que la calidad de sonido sea de tan baja calidad para lo que pagué.,I am fed up with the calidad de sonido of the router.,es,anger,anger,0.945794,True
2025-10-27 12:00:00,Estoy harto de que la experiencia de usuario sea de tan baja calidad para lo que pagué.,I am fed up with the experiencia de usuario of the taxi.,es,anger,anger,0.910083,True
2025-10-27 12:00:00,Me enfadó la mala calidad de sonido del cámara; no cumple lo prometido.,I was angered by the calidad de sonido of the cámara.,es,anger,anger,0.948655,True
2025-10-27 12:00:00,Me irrita que el compañía de telecomunicaciones presente fallos constantes en la compatibilidad.,It irritates me that the compatibilidad of the compañía de telecomunicaciones.,es,anger,anger,0.962488,True
2025-10-27 12:00:00,Estoy harto de que la capacidad de carga sea de tan baja calidad para lo que pagué.,I am fed up with the capacidad de carga of the agencia de viajes.,es,anger,anger,0.95715,True
2025-10-27 12:00:00,Siento frustración por la falta de respuesta ante problemas con la resolución de pantalla.,I feel frustrated by the resolución de pantalla of the silla ergonómica.,es,anger,anger,0.912691,True
2025-10-27 12:00:00,"Estoy muy molesto con la atención, la diseño fue desastrosa.",I am very upset about the diseño of the taller mecánico.,es,anger,anger,0.960707,True
2025-10-27 12:00:00,Me irrita que el licuadora presente fallos constantes en la precisión.,It irritates me that the precisión of the licuadora.,es,anger,anger,0.961001,True
2025-10-27 12:00:00,Siento frustración por la falta de respuesta ante problemas con la conectividad.,I feel frustrated by the conectividad of the maleta.,es,anger,anger,0.930823,True
2025-10-27 12:00:00,"Estoy muy molesto con la atención, la material fue desastrosa.",I am very upset about the material of the cafetera.,es,anger,anger,0.944267,True
2025-10-27 12:00:00,Siento frustración por la falta de respuesta ante problemas con la duración de batería.,I feel frustrated by the duración de batería of the crema facial.,es,anger,anger,0.953894,True
2025-10-27 12:00:00,Me irrita que el detergente presente fallos constantes en la consumo energético.,It irritates me that the consumo energético of the detergente.,es,anger,anger,0.934457,True
2025-10-27 12:00:00,Me enfadó la mala calidad de sonido del lavadora; no cumple lo prometido.,I was angered by the calidad de sonido of the lavadora.,es,anger,anger,0.928721,True
2025-10-27 12:00:00,Me irrita que el lavadora presente fallos constantes en la diseño.,It irritates me that the diseño of the lavadora.,es,anger,anger,0.907295,True
2025-10-27 12:00:00,Me irrita que el restaurante presente fallos constantes en la entrega.,It irritates me that the entrega of the restaurante.,es,anger,anger,0.97067,True
2025-10-27 12:00:00,Me enfadó la mala estabilidad del calefactor; no cumple lo prometido.,I was angered by the estabilidad of the calefactor.,es,anger,anger,0.927557,True
2025-10-27 12:00:00,Me enfadó la mala estabilidad del silla ergonómica; no cumple lo prometido.,I was angered by the estabilidad of the silla ergonómica.,es,anger,anger,0.96689,True
2025-10-27 12:00:00,Me enfadó la mala precisión del detergente; no cumple lo prometido.,I was angered by the precisión of the detergente.,es,anger,anger,0.964577,True
2025-10-27 12:00:00,Me enfadó la mala durabilidad del tablet; no cumple lo prometido.,I was angered by the durabilidad of the tablet.,es,anger,anger,0.931227,True
2025-10-27 12:00:00,"Estoy muy molesto con la atención, la seguridad fue desastrosa.",I am very upset about the seguridad of the plancha.,es,anger,anger,0.911801,True
2025-10-27 12:00:00,Me irrita que el cámara presente fallos constantes en la consumo energético.,It irritates me that the consumo energético of the cámara.,es,anger,anger,0.972171,True
2025-10-27 12:00:00,"Estoy muy molesto con la atención, la compatibilidad fue desastrosa.",I am very upset about the compatibilidad of the ventilador.,es,anger,anger,0.902551,True
2025-10-27 12:00:00,Siento frustración por la falta de respuesta ante problemas con la privacidad.,I feel frustrated by the privacidad of the app bancaria.,es,anger,anger,0.973878,True
2025-10-27 12:00:00,Me irrita que el smartwatch presente fallos constantes en la relación calidad-precio.,It irritates me that the relación calidad-precio of the smartwatch.,es,anger,anger,0.973231,True
2025-10-27 12:00:00,"Estoy muy molesto con la atención, la conectividad fue desastrosa.",I am very upset about the conectividad of the nevera.,es,anger,anger,0.941847,True
2025-10-27 12:00:00,Siento frustración por la falta de respuesta ante problemas con la duración de batería.,I feel frustrated by the duración de batería of the licuadora.,es,anger,anger,0.946306,True
2025-10-27 12:00:00,Me irrita que el router presente fallos constantes en la precisión.,It irritates me that the precisión of the router.,es,anger,anger,0.911227,True
2025-10-27 12:00:00,Siento frustración por la falta de respuesta ante problemas con la conectividad.,I feel frustrated by the conectividad of the monitor.,es,anger,anger,0.905838,True
2025-10-27 12:00:00,"Estoy muy molesto con la atención, la servicio postventa fue desastrosa.",I am very upset about the servicio postventa of the zapatos.,es,anger,anger,0.938618,True
2025-10-27 12:00:00,Me enfadó la mala resolución de pantalla del colchón; no cumple lo prometido.,I was angered by the resolución de pantalla of the colchón.,es,anger,anger,0.941064,True
2025-10-27 12:00:00,Siento frustración por la falta de respuesta ante problemas con la durabilidad.,I feel frustrated by the durabilidad of the microondas.,es,anger,anger,0.951959,True
2025-10-27 12:00:00,Me enfadó la mala calidad de sonido del calefactor; no cumple lo prometido.,I was angered by the calidad de sonido of the calefactor.,es,anger,anger,0.963895,True
2025-10-27 12:00:00,"Estoy muy molesto con la atención, la resolución de pantalla fue desastrosa.",I am very upset about the resolución de pantalla of the envío.,es,anger,anger,0.964901,True
2025-10-27 12:00:00,Me enfadó la mala capacidad de carga del bicicleta; no cumple lo prometido.,I was angered by the capacidad de carga of the bicicleta.,es,anger,anger,0.955022,True
2025-10-27 12:00:00,Me enfadó la mala relación calidad-precio del taxi; no cumple lo prometido.,I was angered by the relación calidad-precio of the taxi.,es,anger,anger,0.938352,True
2025-10-27 12:00:00,"Estoy muy molesto con la atención, la conectividad fue desastrosa.",I am very upset about the conectividad of the taxi.,es,anger,anger,0.914412,True
2025-10-27 12:00:00,Siento frustración por la falta de respuesta ante problemas con la conectividad.,I feel frustrated by the conectividad of the silla ergonómica.,es,anger,anger,0.933169,True
2025-10-27 12:00:00,Me enfadó la mala funcionalidades del televisor; no cumple lo prometido.,I was angered by the funcionalidades of the televisor.,es,anger,anger,0.969207,True
2025-10-27 12:00:00,Estoy harto de que la compatibilidad sea de tan baja calidad para lo que pagué.,I am fed up with the compatibilidad of the cámara.,es,anger,anger,0.955751,True
2025-10-27 12:00:00,Me enfadó la mala entrega del router; no cumple lo prometido.,I was angered by the entrega of the router.,es,anger,anger,0.945098,True
2025-10-27 12:00:00,Me irrita que el detergente presente fallos constantes en la durabilidad.,It irritates me that the durabilidad of the detergente.,es,anger,anger,0.93759,True
2025-10-27 12:00:00,Me enfadó la mala garantía del agencia de viajes; no cumple lo prometido.,I was angered by the garantía of the agencia de viajes.,es,anger,anger,0.988759,True
2025-10-27 12:00:00,Me enfadó la mala conectividad del compañía de telecomunicaciones; no cumple lo prometido.,I was angered by the conectividad of the compañía de telecomunicaciones.,es,anger,anger,0.983159,True
2025-10-27 12:00:00,Siento frustración por la falta de respuesta ante problemas con la rendimiento.,I feel frustrated by the rendimiento of the servicio de streaming.,es,anger,anger,0.960048,True
2025-10-27 12:00:00,Me enfadó la mala velocidad del tablet; no cumple lo prometido.,I was angered by the velocidad of the tablet.,es,anger,anger,0.905998,True
2025-10-27 12:00:00,Me irrita que el impresora presente fallos constantes en la sensibilidad.,It irritates me that the sensibilidad of the impresora.,es,anger,anger,0.965663,True
2025-10-27 12:00:00,Me enfadó la mala funcionalidades del bicicleta; no cumple lo prometido.,I was angered by the funcionalidades of the bicicleta.,es,anger,anger,0.937881,True
2025-10-27 12:00:00,Siento frustración por la falta de respuesta ante problemas con la puntualidad.,I feel frustrated by the puntualidad of the plancha.,es,anger,anger,0.970937,True
2025-10-27 12:00:00,Estoy harto de que la acabado sea de tan baja calidad para lo que pagué.,I am fed up with the acabado of the crema facial.,es,anger,anger,0.952215,True
2025-10-27 12:00:00,Siento frustración por la falta de respuesta ante problemas con la velocidad.,I feel frustrated by the velocidad of the teléfono.,es,anger,anger,0.969778,True
2025-10-27 12:00:00,Me enfadó la mala entrega del reloj inteligente; no cumple lo prometido.,I was angered by the entrega of the reloj inteligente.,es,anger,anger,0.957961,True
2025-10-27 12:00:00,Me enfadó la mala atención al cliente del plancha; no cumple lo prometido.,I was angered by the atención al cliente of the plancha.,es,anger,anger,0.976534,True
2025-10-27 12:00:00,Estoy harto de que la compatibilidad sea de tan baja calidad para lo que pagué.,I am fed up with the compatibilidad of the router.,es,anger,anger,0.961071,True
2025-10-27 12:00:00,Me irrita que el reloj inteligente presente fallos constantes en la durabilidad.,It irritates me that the durabilidad of the reloj inteligente.,es,anger,anger,0.909856,True
2025-10-27 12:00:00,"Estoy muy molesto con la atención, la actualizaciones fue desastrosa.",I am very upset about the actualizaciones of the reloj inteligente.,es,anger,anger,0.931047,True
2025-10-27 12:00:00,Estoy harto de que la sensibilidad sea de tan baja calidad para lo que pagué.,I am fed up with the sensibilidad of the zapatos.,es,anger,anger,0.979751,True
2025-10-27 12:00:00,Siento frustración por la falta de respuesta ante problemas con la conectividad.,I feel frustrated by the conectividad of the plataforma de cursos.,es,anger,anger,0.957904,True
2025-10-27 12:00:00,Estoy harto de que la entrega sea de tan baja calidad para lo que pagué.,I am fed up with the entrega of the televisor.,es,anger,anger,0.964777,True
2025-10-27 12:00:00,Siento frustración por la falta de respuesta ante problemas con la resolución de pantalla.,I feel frustrated by the resolución de pantalla of the hotel.,es,anger,anger,0.972301,True
2025-10-27 12:00:00,Me irrita que el app bancaria presente fallos constantes en la precisión.,It irritates me that the precisión of the app bancaria.,es,anger,anger,0.983612,True
2025-10-27 12:00:00,Estoy harto de que la experiencia de usuario sea de tan baja calidad para lo que pagué.,I am fed up with the experiencia de usuario of the colchón.,es,anger,anger,0.947081,True
2025-10-27 12:00:00,Me enfadó la mala rendimiento del altavoz; no cumple lo prometido.,I was angered by the rendimiento of the altavoz.,es,anger,anger,0.984853,True
2025-10-27 12:00:00,Estoy harto de que la velocidad sea de tan baja calidad para lo que pagué.,I am fed up with the velocidad of the almohada.,es,anger,anger,0.942129,True
2025-10-27 12:00:00,Siento frustración por la falta de respuesta ante problemas con la sensibilidad.,I feel frustrated by the sensibilidad of the taxi.,es,anger,anger,0.903728,True
2025-10-27 12:00:00,"Estoy muy molesto con la atención, la resolución de pantalla fue desastrosa.",I am very upset about the resolución de pantalla of the plataforma de cursos.,es,anger,anger,0.927479,True
2025-10-27 12:00:00,Me irrita que el compañía de telecomunicaciones presente fallos constantes en la material.,It irritates me that the material of the compañía de telecomunicaciones.,es,anger,anger,0.974202,True
2025-10-27 12:00:00,Estoy harto de que la precisión sea de tan baja calidad para lo que pagué.,I am fed up with the precisión of the bicicleta.,es,anger,anger,0.90389,True
