timestamp,texto_original,texto_traducido,idioma,emocion_predicha,emocion_correcta,confianza,es_correcto
2025-10-27 12:00:00,No imaginé que el mochila tuviera una experiencia de usuario de este nivel.,No imaginé que the mochila tuviera una experiencia de usuario de este nivel..,es,surprise,surprise,0.912273,True
2025-10-27 12:00:00,Fue una sorpresa descubrir que la experiencia de usuario del microondas funciona tan bien.,Fue una sorpresa descubrir que the experiencia de usuario of the microondas funciona tan bien..,es,surprise,surprise,0.903922,True
2025-10-27 12:00:00,Me dejó sorprendido el rendimiento de la atención al cliente frente a productos similares.,Me dejó sorprendido the rendimiento de the atención al cliente frente a productos similares..,es,surprise,surprise,0.911687,True
2025-10-27 12:00:00,Quedé asombrado por la calidad de la capacidad de carga en este servicio.,I was amazed by the capacidad de carga of the altavoz.,es,surprise,surprise,0.938042,True
2025-10-27 12:00:00,No imaginé que el router tuviera una calidad de sonido de este nivel.,No imaginé que the router tuviera una calidad de sonido de este nivel..,es,surprise,surprise,0.908337,True
2025-10-27 12:00:00,Fue una sorpresa descubrir que la interfaz del televisor funciona tan bien.,Fue una sorpresa descubrir que the interfaz of the televisor funciona tan bien..,es,surprise,surprise,0.952067,True
2025-10-27 12:00:00,Quedé asombrado por la calidad de la consumo energético en este servicio.,I was amazed by the consumo energético of the soporte técnico.,es,surprise,surprise,0.917363,True
2025-10-27 12:00:00,No imaginé que el taxi tuviera una sensibilidad de este nivel.,No imaginé que the taxi tuviera una sensibilidad de este nivel..,es,surprise,surprise,0.978923,True
2025-10-27 12:00:00,Fue una sorpresa descubrir que la capacidad de carga del microondas funciona tan bien.,Fue una sorpresa descubrir que the capacidad de carga of the microondas funciona tan bien..,es,surprise,surprise,0.938157,True
2025-10-27 12:00:00,Me dejó sorprendido el rendimiento de la interfaz frente a productos similares.,Me dejó sorprendido the rendimiento de the interfaz frente a productos similares..,es,surprise,surprise,0.910236,True
2025-10-27 12:00:00,Fue una sorpresa descubrir que la calidad de sonido del altavoz funciona tan bien.,Fue una sorpresa descubrir que the calidad de sonido of the altavoz funciona tan bien..,es,surprise,surprise,0.926472,True
2025-10-27 12:00:00,Me dejó sorprendido el rendimiento de la duración de batería frente a productos similares.,Me dejó sorprendido the rendimiento de the duración de batería frente a productos similares..,es,surprise,surprise,0.914438,True
2025-10-27 12:00:00,No imaginé que el ventilador tuviera una puntualidad de este nivel.,No imaginé que the ventilador tuviera una puntualidad de este nivel..,es,surprise,surprise,0.963696,True
2025-10-27 12:00:00,Me dejó sorprendido el rendimiento de la sensibilidad frente a productos similares.,Me dejó sorprendido the rendimiento de the sensibilidad frente a productos similares..,es,surprise,surprise,0.939285,True
2025-10-27 12:00:00,No imaginé que el altavoz tuviera una experiencia de usuario de este nivel.,No imaginé que the altavoz tuviera una experiencia de usuario de este nivel..,es,surprise,surprise,0.970283,True
2025-10-27 12:00:00,No imaginé que el almohada tuviera una diseño de este nivel.,No imaginé que the almohada tuviera una diseño de este nivel..,es,surprise,surprise,0.963247,True
2025-10-27 12:00:00,Me dejó sorprendido el rendimiento de la acabado frente a productos similares.,Me dejó sorprendido the rendimiento de the acabado frente a productos similares..,es,surprise,surprise,0.956943,True
2025-10-27 12:00:00,Quedé asombrado por la calidad de la sensibilidad en este servicio.,I was amazed by the sensibilidad of the calefactor.,es,surprise,surprise,0.938064,True
2025-10-27 12:00:00,Fue una sorpresa descubrir que la puntualidad del tablet funciona tan bien.,Fue una sorpresa descubrir que the puntualidad of the tablet funciona tan bien..,es,surprise,surprise,0.970135,True
2025-10-27 12:00:00,Me sorprendió gratamente la relación calidad-precio del microondas; no lo esperaba.,I was surprised by the relación calidad-precio of the microondas.,es,surprise,surprise,0.914817,True
2025-10-27 12:00:00,Quedé asombrado por la calidad de la velocidad en este servicio.,I was amazed by the velocidad of the chaqueta.,es,surprise,surprise,0.984947,True
2025-10-27 12:00:00,Fue una sorpresa descubrir que la compatibilidad del envío funciona tan bien.,Fue una sorpresa descubrir que the compatibilidad of the envío funciona tan bien..,es,surprise,surprise,0.982643,True
2025-10-27 12:00:00,Fue una sorpresa descubrir que la duración de batería del estufa funciona tan bien.,Fue una sorpresa descubrir que the duración de batería of the estufa funciona tan bien..,es,surprise,surprise,0.910625,True
2025-10-27 12:00:00,Me sorprendió gratamente la calidad de sonido del firma de lavandería; no lo esperaba.,I was surprised by the calidad de sonido of the firma de lavandería.,es,surprise,surprise,0.988991,True
2025-10-27 12:00:00,Me dejó sorprendido el rendimiento de la sensibilidad frente a productos similares.,Me dejó sorprendido the rendimiento de the sensibilidad frente a productos similares..,es,surprise,surprise,0.954793,True
2025-10-27 12:00:00,Fue una sorpresa descubrir que la privacidad del estufa funciona tan bien.,Fue una sorpresa descubrir que the privacidad of the estufa funciona tan bien..,es,surprise,surprise,0.964897,True
2025-10-27 12:00:00,Quedé asombrado por la calidad de la servicio postventa en este servicio.,I was amazed by the servicio postventa of the taller mecánico.,es,surprise,surprise,0.95162,True
2025-10-27 12:00:00,Me dejó sorprendido el rendimiento de la puntualidad frente a productos similares.,Me dejó sorprendido the rendimiento de the puntualidad frente a productos similares..,es,surprise,surprise,0.90664,True
2025-10-27 12:00:00,Me dejó sorprendido el rendimiento de la acabado frente a productos similares.,Me dejó sorprendido the rendimiento de the acabado frente a productos similares..,es,surprise,surprise,0.921612,True
2025-10-27 12:00:00,Me dejó sorprendido el rendimiento de la experiencia de usuario frente a productos similares.,Me dejó sorprendido the rendimiento de the experiencia de usuario frente a productos similares..,es,surprise,surprise,0.938494,True
2025-10-27 12:00:00,Quedé asombrado por la calidad de la puntualidad en este servicio.,I was amazed by the puntualidad of the cámara.,es,surprise,surprise,0.921805,True
2025-10-27 12:00:00,Fue una sorpresa descubrir que la privacidad del plancha funciona tan bien.,Fue una sorpresa descubrir que the privacidad of the plancha funciona tan bien..,es,surprise,surprise,0.989907,True
2025-10-27 12:00:00,Quedé asombrado por la calidad de la atención al cliente en este servicio.,I was amazed by the atención al cliente of the ventilador.,es,surprise,surprise,0.982697,True
2025-10-27 12:00:00,Quedé asombrado por la calidad de la entrega en este servicio.,I was amazed by the entrega of the plataforma de cursos.,es,surprise,surprise,0.972962,True
2025-10-27 12:00:00,Quedé asombrado por la calidad de la seguridad en este servicio.,I was amazed by the seguridad of the soporte técnico.,es,surprise,surprise,0.957006,True
2025-10-27 12:00:00,Fue una sorpresa descubrir que la garantía del detergente funciona tan bien.,Fue una sorpresa descubrir que the garantía of the detergente funciona tan bien..,es,surprise,surprise,0.971331,True
2025-10-27 12:00:00,Fue una sorpresa descubrir que la puntualidad del reloj inteligente funciona tan bien.,Fue una sorpresa descubrir que the puntualidad of the reloj inteligente funciona tan bien..,es,surprise,surprise,0.950263,True
2025-10-27 12:00:00,Me dejó sorprendido el rendimiento de la conectividad frente a productos similares.,Me dejó sorprendido the rendimiento de the conectividad frente a productos similares..,es,surprise,surprise,0.947229,True
2025-10-27 12:00:00,Me dejó sorprendido el rendimiento de la conectividad frente a productos similares.,Me dejó sorprendido the rendimiento de the conectividad frente a productos similares..,es,surprise,surprise,0.957164,True
2025-10-27 12:00:00,Quedé asombrado por la calidad de la seguridad en este servicio.,I was amazed by the seguridad of the hotel.,es,surprise,surprise,0.957431,True
2025-10-27 12:00:00,No imaginé que el microondas tuviera una seguridad de este nivel.,No imaginé que the microondas tuviera una seguridad de este nivel..,es,surprise,surprise,0.974892,True
2025-10-27 12:00:00,Fue una sorpresa descubrir que la capacidad de carga del crema facial funciona tan bien.,Fue una sorpresa descubrir que the capacidad de carga of the crema facial funciona tan bien..,es,surprise,surprise,0.930738,True
2025-10-27 12:00:00,Me dejó sorprendido el rendimiento de la servicio postventa frente a productos similares.,Me dejó sorprendido the rendimiento de the servicio postventa frente a productos similares..,es,surprise,surprise,0.939773,True
2025-10-27 12:00:00,No imaginé que el crema facial tuviera una estabilidad de este nivel.,No imaginé que the crema facial tuviera una estabilidad de este nivel..,es,surprise,surprise,0.985837,True
2025-10-27 12:00:00,Me dejó sorprendido el rendimiento de la compatibilidad frente a productos similares.,Me dejó sorprendido the rendimiento de the compatibilidad frente a productos similares..,es,surprise,surprise,0.92955,True
2025-10-27 12:00:00,No imaginé que el televisor tuviera una duración de batería de este nivel.,No imaginé que the televisor tuviera una duración de batería de este nivel..,es,surprise,surprise,0.98516,True
2025-10-27 12:00:00,Me sorprendió gratamente la compatibilidad del soporte técnico; no lo esperaba.,I was surprised by the compatibilidad of the soporte técnico.,es,surprise,surprise,0.916088,True
2025-10-27 12:00:00,No imaginé que el cafetera tuviera una rendimiento de este nivel.,No imaginé que the cafetera tuviera una rendimiento de este nivel..,es,surprise,surprise,0.947405,True
2025-10-27 12:00:00,No imaginé que el plancha tuviera una velocidad de este nivel.,No imaginé que the plancha tuviera una velocidad de este nivel..,es,surprise,surprise,0.913008,True
2025-10-27 12:00:00,Me dejó sorprendido el rendimiento de la duración de batería frente a productos similares.,Me dejó sorprendido the rendimiento de the duración de batería frente a productos similares..,es,surprise,surprise,0.985158,True
2025-10-27 12:00:00,Me sorprendió gratamente la capacidad de carga del calefactor; no lo esperaba.,I was surprised by the capacidad de carga of the calefactor.,es,surprise,surprise,0.965318,True
2025-10-27 12:00:00,Fue una sorpresa descubrir que la material del zapatos funciona tan bien.,Fue una sorpresa descubrir que the material of the zapatos funciona tan bien..,es,surprise,surprise,0.945248,True
2025-10-27 12:00:00,Me sorprendió gratamente la material del teléfono; no lo esperaba.,I was surprised by the material of the teléfono.,es,surprise,surprise,0.922998,True
2025-10-27 12:00:00,Me sorprendió gratamente la servicio postventa del compañía de telecomunicaciones; no lo esperaba.,I was surprised by the servicio postventa of the compañía de telecomunicaciones.,es,surprise,surprise,0.922744,True
2025-10-27 12:00:00,Me sorprendió gratamente la precisión del plataforma de cursos; no lo esperaba.,I was surprised by the precisión of the plataforma de cursos.,es,surprise,surprise,0.981946,True
2025-10-27 12:00:00,Fue una sorpresa descubrir que la acabado del microondas funciona tan bien.,Fue una sorpresa descubrir que the acabado of the microondas funciona tan bien..,es,surprise,surprise,0.973314,True
2025-10-27 12:00:00,Fue una sorpresa descubrir que la calidad de sonido del envío funciona tan bien.,Fue una sorpresa descubrir que the calidad de sonido of the envío funciona tan bien..,es,surprise,surprise,0.96891,True
2025-10-27 12:00:00,Quedé asombrado por la calidad de la resolución de pantalla en este servicio.,I was amazed by the resolución de pantalla of the hotel.,es,surprise,surprise,0.945982,True
2025-10-27 12:00:00,Quedé asombrado por la calidad de la comodidad en este servicio.,I was amazed by the comodidad of the cafetera.,es,surprise,surprise,0.947394,True
2025-10-27 12:00:00,Me dejó sorprendido el rendimiento de la calidad de sonido frente a productos similares.,Me dejó sorprendido the rendimiento de the calidad de sonido frente a productos similares..,es,surprise,surprise,0.969973,True
2025-10-27 12:00:00,No imaginé que el impresora tuviera una puntualidad de este nivel.,No imaginé que the impresora tuviera una puntualidad de este nivel..,es,surprise,surprise,0.962188,True
2025-10-27 12:00:00,Fue una sorpresa descubrir que la sensibilidad del nevera funciona tan bien.,Fue una sorpresa descubrir que the sensibilidad of the nevera funciona tan bien..,es,surprise,surprise,0.968071,True
2025-10-27 12:00:00,Me sorprendió gratamente la privacidad del nevera; no lo esperaba.,I was surprised by the privacidad of the nevera.,es,surprise,surprise,0.964098,True
2025-10-27 12:00:00,Quedé asombrado por la calidad de la relación calidad-precio en este servicio.,I was amazed by the relación calidad-precio of the detergente.,es,surprise,surprise,0.933324,True
2025-10-27 12:00:00,No imaginé que el soporte técnico tuviera una servicio postventa de este nivel.,No imaginé que the soporte técnico tuviera una servicio postventa de este nivel..,es,surprise,surprise,0.912589,True
2025-10-27 12:00:00,No imaginé que el cámara tuviera una garantía de este nivel.,No imaginé que the cámara tuviera una garantía de este nivel..,es,surprise,surprise,0.955696,True
2025-10-27 12:00:00,No imaginé que el plataforma de cursos tuviera una funcionalidades de este nivel.,No imaginé que the plataforma de cursos tuviera una funcionalidades de este nivel..,es,surprise,surprise,0.94467,True
2025-10-27 12:00:00,Fue una sorpresa descubrir que la comodidad del cafetera funciona tan bien.,Fue una sorpresa descubrir que the comodidad of the cafetera funciona tan bien..,es,surprise,surprise,0.950233,True
2025-10-27 12:00:00,Quedé asombrado por la calidad de la material en este servicio.,I was amazed by the material of the detergente.,es,surprise,surprise,0.950569,True
2025-10-27 12:00:00,Quedé asombrado por la calidad de la facilidad de uso en este servicio.,I was amazed by the facilidad de uso of the envío.,es,surprise,surprise,0.949849,True
2025-10-27 12:00:00,Me sorprendió gratamente la privacidad del teléfono; no lo esperaba.,I was surprised by the privacidad of the teléfono.,es,surprise,surprise,0.957116,True
2025-10-27 12:00:00,Me dejó sorprendido el rendimiento de la privacidad frente a productos similares.,Me dejó sorprendido the rendimiento de the privacidad frente a productos similares..,es,surprise,surprise,0.917463,True
2025-10-27 12:00:00,Fue una sorpresa descubrir que la diseño del servicio de streaming funciona tan bien.,Fue una sorpresa descubrir que the diseño of the servicio de streaming funciona tan bien..,es,surprise,surprise,0.951332,True
2025-10-27 12:00:00,Fue una sorpresa descubrir que la duración de batería del taller mecánico funciona tan bien.,Fue una sorpresa descubrir que the duración de batería of the taller mecánico funciona tan bien..,es,surprise,surprise,0.948382,True
2025-10-27 12:00:00,Me dejó sorprendido el rendimiento de la material frente a productos similares.,Me dejó sorprendido the rendimiento de the material frente a productos similares..,es,surprise,surprise,0.901518,True
2025-10-27 12:00:00,No imaginé que el chaqueta tuviera una seguridad de este nivel.,No imaginé que the chaqueta tuviera una seguridad de este nivel..,es,surprise,surprise,0.933601,True
2025-10-27 12:00:00,No imaginé que el aspiradora tuviera una durabilidad de este nivel.,No imaginé que the aspiradora tuviera una durabilidad de este nivel..,es,surprise,surprise,0.918778,True
2025-10-27 12:00:00,Me dejó sorprendido el rendimiento de la funcionalidades frente a productos similares.,Me dejó sorprendido the rendimiento de the funcionalidades frente a productos similares..,es,surprise,surprise,0.946413,True
2025-10-27 12:00:00,Quedé asombrado por la calidad de la puntualidad en este servicio.,I was amazed by the puntualidad of the impresora.,es,surprise,surprise,0.92727,True
2025-10-27 12:00:00,Fue una sorpresa descubrir que la atención al cliente del firma de lavandería funciona tan bien.,Fue una sorpresa descubrir que the atención al cliente of the firma de lavandería funciona tan bien..,es,surprise,surprise,0.910662,True
2025-10-27 12:00:00,Quedé asombrado por la calidad de la entrega en este servicio.,I was amazed by the entrega of the servicio de streaming.,es,surprise,surprise,0.978466,True
2025-10-27 12:00:00,Me sorprendió gratamente la rendimiento del mochila; no lo esperaba.,I was surprised by the rendimiento of the mochila.,es,surprise,surprise,0.960988,True
2025-10-27 12:00:00,Fue una sorpresa descubrir que la garantía del teléfono funciona tan bien.,Fue una sorpresa descubrir que the garantía of the teléfono funciona tan bien..,es,surprise,surprise,0.946465,True
2025-10-27 12:00:00,Quedé asombrado por la calidad de la velocidad en este servicio.,I was amazed by the velocidad of the calefactor.,es,surprise,surprise,0.91913,True
2025-10-27 12:00:00,Me sorprendió gratamente la facilidad de uso del almohada; no lo esperaba.,I was surprised by the facilidad de uso of the almohada.,es,surprise,surprise,0.924967,True
2025-10-27 12:00:00,Me dejó sorprendido el rendimiento de la velocidad frente a productos similares.,Me dejó sorprendido the rendimiento de the velocidad frente a productos similares..,es,surprise,surprise,0.952389,True
2025-10-27 12:00:00,Fue una sorpresa descubrir que la comodidad del licuadora funciona tan bien.,Fue una sorpresa descubrir que the comodidad of the licuadora funciona tan bien..,es,surprise,surprise,0.935685,True
2025-10-27 12:00:00,No imaginé que el restaurante tuviera una actualizaciones de este nivel.,No imaginé que the restaurante tuviera una actualizaciones de este nivel..,es,surprise,surprise,0.957167,True
2025-10-27 12:00:00,No imaginé que el calefactor tuviera una servicio postventa de este nivel.,No imaginé que the calefactor tuviera una servicio postventa de este nivel..,es,surprise,surprise,0.962904,True
2025-10-27 12:00:00,Fue una sorpresa descubrir que la funcionalidades del bicicleta funciona tan bien.,Fue una sorpresa descubrir que the funcionalidades of the bicicleta funciona tan bien..,es,surprise,surprise,0.937224,True
2025-10-27 12:00:00,Quedé asombrado por la calidad de la duración de batería en este servicio.,I was amazed by the duración de batería of the mochila.,es,surprise,surprise,0.961162,True
2025-10-27 12:00:00,Me dejó sorprendido el rendimiento de la experiencia de usuario frente a productos similares.,Me dejó sorprendido the rendimiento de the experiencia de usuario frente a productos similares..,es,surprise,surprise,0.903774,True
2025-10-27 12:00:00,Quedé asombrado por la calidad de la durabilidad en este servicio.,I was amazed by the durabilidad of the auriculares.,es,surprise,surprise,0.989022,True
2025-10-27 12:00:00,Me sorprendió gratamente la diseño del cámara; no lo esperaba.,I was surprised by the diseño of the cámara.,es,surprise,surprise,0.919151,True
2025-10-27 12:00:00,No imaginé que el estufa tuviera una diseño de este nivel.,No imaginé que the estufa tuviera una diseño de este nivel..,es,surprise,surprise,0.975153,True
2025-10-27 12:00:00,Me sorprendió gratamente la durabilidad del maleta; no lo esperaba.,I was surprised by the durabilidad of the maleta.,es,surprise,surprise,0.947919,True
2025-10-27 12:00:00,Quedé asombrado por la calidad de la funcionalidades en este servicio.,I was amazed by the funcionalidades of the estufa.,es,surprise,surprise,0.942404,True
2025-10-27 12:00:00,Fue una sorpresa descubrir que la precisión del teléfono funciona tan bien.,Fue una sorpresa descubrir que the precisión of the teléfono funciona tan bien..,es,surprise,surprise,0.967485,True
2025-10-27 12:00:00,Me dejó sorprendido el rendimiento de la durabilidad frente a productos similares.,Me dejó sorprendido the rendimiento de the durabilidad frente a productos similares..,es,surprise,surprise,0.978964,True
2025-10-27 12:00:00,No imaginé que el nevera tuviera una relación calidad-precio de este nivel.,No imaginé que the nevera tuviera una relación calidad-precio de este nivel..,es,surprise,surprise,0.919411,True
2025-10-27 12:00:00,Me dejó sorprendido el rendimiento de la resolución de pantalla frente a productos similares.,Me dejó sorprendido the rendimiento de the resolución de pantalla frente a productos similares..,es,surprise,surprise,0.932461,True
2025-10-27 12:00:00,No imaginé que el router tuviera una calidad de sonido de este nivel.,No imaginé que the router tuviera una calidad de sonido de este nivel..,es,surprise,surprise,0.919984,True
2025-10-27 12:00:00,Fue una sorpresa descubrir que la puntualidad del maleta funciona tan bien.,Fue una sorpresa descubrir que the puntualidad of the maleta funciona tan bien..,es,surprise,surprise,0.937322,True
2025-10-27 12:00:00,Me sorprendió gratamente la interfaz del app bancaria; no lo esperaba.,I was surprised by the interfaz of the app bancaria.,es,surprise,surprise,0.925199,True
2025-10-27 12:00:00,No imaginé que el taller mecánico tuviera una diseño de este nivel.,No imaginé que the taller mecánico tuviera una diseño de este nivel..,es,surprise,surprise,0.938591,True
2025-10-27 12:00:00,Quedé asombrado por la calidad de la puntualidad en este servicio.,I was amazed by the puntualidad of the cámara.,es,surprise,surprise,0.977806,True
2025-10-27 12:00:00,Quedé asombrado por la calidad de la servicio postventa en este servicio.,I was amazed by the servicio postventa of the altavoz.,es,surprise,surprise,0.946513,True
2025-10-27 12:00:00,Fue una sorpresa descubrir que la atención al cliente del televisor funciona tan bien.,Fue una sorpresa descubrir que the atención al cliente of the televisor funciona tan bien..,es,surprise,surprise,0.926964,True
2025-10-27 12:00:00,Me dejó sorprendido el rendimiento de la durabilidad frente a productos similares.,Me dejó sorprendido the rendimiento de the durabilidad frente a productos similares..,es,surprise,surprise,0.986809,True
2025-10-27 12:00:00,No imaginé que el silla ergonómica tuviera una puntualidad de este nivel.,No imaginé que the silla ergonómica tuviera una puntualidad de este nivel..,es,surprise,surprise,0.98722,True
2025-10-27 12:00:00,No imaginé que el silla ergonómica tuviera una garantía de este nivel.,No imaginé que the silla ergonómica tuviera una garantía de este nivel..,es,surprise,surprise,0.934451,True
2025-10-27 12:00:00,Me sorprendió gratamente la atención al cliente del zapatos; no lo esperaba.,I was surprised by the atención al cliente of the zapatos.,es,surprise,surprise,0.93477,True
2025-10-27 12:00:00,Me sorprendió gratamente la durabilidad del compañía de telecomunicaciones; no lo esperaba.,I was surprised by the durabilidad of the compañía de telecomunicaciones.,es,surprise,surprise,0.965835,True
2025-10-27 12:00:00,Quedé asombrado por la calidad de la privacidad en este servicio.,I was amazed by the privacidad of the cámara.,es,surprise,surprise,0.936714,True
2025-10-27 12:00:00,Quedé asombrado por la calidad de la diseño en este servicio.,I was amazed by the diseño of the soporte técnico.,es,surprise,surprise,0.947434,True
2025-10-27 12:00:00,Me sorprendió gratamente la consumo energético del ventilador; no lo esperaba.,I was surprised by the consumo energético of the ventilador.,es,surprise,surprise,0.95228,True
2025-10-27 12:00:00,No imaginé que el envío tuviera una experiencia de usuario de este nivel.,No imaginé que the envío tuviera una experiencia de usuario de este nivel..,es,surprise,surprise,0.985895,True
2025-10-27 12:00:00,Me sorprendió gratamente la actualizaciones del silla ergonómica; no lo esperaba.,I was surprised by the actualizaciones of the silla ergonómica.,es,surprise,surprise,0.982368,True
2025-10-27 12:00:00,Quedé asombrado por la calidad de la acabado en este servicio.,I was amazed by the acabado of the monitor.,es,surprise,surprise,0.914394,True
2025-10-27 12:00:00,Fue una sorpresa descubrir que la atención al cliente del calefactor funciona tan bien.,Fue una sorpresa descubrir que the atención al cliente of the calefactor funciona tan bien..,es,surprise,surprise,0.910557,True
2025-10-27 12:00:00,Me dejó sorprendido el rendimiento de la acabado frente a productos similares.,Me dejó sorprendido the rendimiento de the acabado frente a productos similares..,es,surprise,surprise,0.921928,True
2025-10-27 12:00:00,Quedé asombrado por la calidad de la entrega en este servicio.,I was amazed by the entrega of the mochila.,es,surprise,surprise,0.934075,True
2025-10-27 12:00:00,Me sorprendió gratamente la conectividad del estufa; no lo esperaba.,I was surprised by the conectividad of the estufa.,es,surprise,surprise,0.958512,True
2025-10-27 12:00:00,Me dejó sorprendido el rendimiento de la capacidad de carga frente a productos similares.,Me dejó sorprendido the rendimiento de the capacidad de carga frente a productos similares..,es,surprise,surprise,0.901582,True
2025-10-27 12:00:00,No imaginé que el compañía de telecomunicaciones tuviera una funcionalidades de este nivel.,No imaginé que the compañía de telecomunicaciones tuviera una funcionalidades de este nivel..,es,surprise,surprise,0.905484,True
